transcription,recording_id,model_transcription
i say again malaysian four contact rhein radar one two seven decimal three seven,051_0343,saigan malaysian four contact rhein radar one two seven decimal three seven
swissair four eight eight good morning maintain two eight zero when reaching call you back for higher,101_0586,swissair four eight eight good morning maintain two eight zero and reation call you back for higher
tag belstar five oh two hotel identified,061_0119,tag belsa five oh two hotel identified
lufthansa five five zero four contact geneva milan one three four five two bye,101_0449,lufthansa five five zero four contact geneva ohh milan one three four five two bye
netherlands air force four one four descend flight level three two zero expedite descent as crossing traffic,071_0257,netherlands air force four one four descend flight level three two zero expet i descent as crossing traffic
yeah,021_0031,a
lufthansa five five zero four zurich radar good morning identified trasadingen to s fribourg maintain flight level three three zero,092_0046,lufthansa five five zero four zurich radar good morning identified trasadingen to s fribo maintain flight level three three zer
lufthansa four six five two bonjour identified cleared passeiry la tour du pin flight level three zero zero stand by for higher,072_0175,ftansa four six five two bonjour identified cleared pasreela tour du pin flight level three zero zero stand by for higher
saudia three four one good morning maintain flight level three three zero got radar contact,081_0553,sauda three four one good morning maintain flight level three three zero go radar contact
cross air six eight six contact marseille one two five eight five good bye,071_0746,sair six eight six contact marseille one two five eight five good bye
golf bravo victor juliett india is identified good afternoon,051_0227,goll bravo victor juliett india is identified good afternoon
jetaviation seven zero one direct ah fribourg,081_0709,jetaviation seven zero one direct affriebourg
gulf air zero zero five good afternoon radar contact,071_0086,alfair zero zero five good afternoon radar contact
lufthansa three five si six six contact zurich one three four six tschuss,031_0204,lufthansa three five six six six contact zurich one three four six tschuss
lufthansa three six three eight guten morgen climb to flight level two seven zero,021_0495,lufthansa three six three eight good morging climb to flight level two seven zero
japan air four one nine contact milan one three four five two bye,101_0308,german air four one nine contact milan one three four five two bye
