transcription,recording_id,model_transcription
saudia one eight three contact rhein control one three two decimal four bye,081_0450,saudiar one eight three contact rhein control one three two decimal four bye
sabena nine five nine bonjour identified passeiry tour du pin flight level three one zero,071_0497,sabena nine five nine bonjour identified passeiry to du pin flight level three one zero
ah eva three two one bonjour identified cleared passeiry la tour du pin flight level two nine zero,071_0937,viva three two one bonjour identified cleared passeiry la tour du pin flight level two nine zero
lufthansa eight two six eight good morning maintain level two nine zero willisau st prex,081_0200,lufthansa eight two six eight good morning maintain level two nine zero vidisau st prex
emirates two is identified,011_0177,amrits two is identified
ah london airtours one contact milano one three four decimal five two,051_0317,air london air two is one contact milano one three four decimal five two
aero lloyd five one seven ah turn left to trasadingen,081_0808,aero lloyd five one seven turn left to trasadingen
airfrans six seven zero descend flight level two five zero rate at least two thousand five hundred,101_0120,airfrans six seven zero descend flight level two five zero radi at least two thousand five hundred
turkair nine two five good morning squawk one zero zero five,091_0914,tag a nine two five good morning squawk one zero zero five
speedbird ah one two f four contact rhein one two seven three seven,051_0127,speedbird ah one two four contact rhein one two seven three seven
lufthansa three five seven seven rhein one three two one three two four tschuss,092_0243,lufthansa three five seven seven rhein one three two one three two four just
sata nine six zero one bonjour cleared direct la tour du pin flight level three three zero,071_0760,sata nine six zero one bonjour cleared ah direct la tour du pin flight level three three zero
exact,111_0627,expect
bama one five zurich radar good morning identified maintain flight level three three zero trasadingen stand by,091_0997,bama one five zurich radar good morning identified maintain flight level three three zero trasadingenstand by
ah roger turn ah left heading two one five to keep you within the airway,092_0161,ah roger turn ah left heading two one five t keep you with indierre
lufthansa four two zero nine continue descent ah disregard ill call you back for further descent in a minute,041_0620,lufthansa four two zero nine continue descent ah disregard ill call you back further descent in a minute
okay switch over to reims please,101_0891,okays with a o two rheins please
alitalia two one six identified cleared st prex arbos epinal climb to flight level three zero zero,071_0668,alitalia two one six identified cleared st prex armo sabina climb to flight level three zero zero
speedbird seven seven whiskey whiskey contact reims one three four decimal four good day,092_0407,speedbird seven seven whiskee whiskee contact reims one three four decimal four good day
jat two seven three is identified,051_0647,air two seven three is identified
foxtrot sierra india rhein radar identified call you back for higher,051_0009,foxtrot sierra india rhein radar identified cal you back further
rhein contact geneva one two eight decimal one five au revoir,071_0836,and contact geneva one two eight decimal one five au revoir
ah delta echo charlie im not sure whether you got it you proceed to dinkelsbuhl,011_0349,ah delta echo charlie immo two whether you gied you proceed direct to dinkelsbuhl
turkish five one five contact rhein one two seven decimal three seven,071_0289,burkaish five one five contact rhein one two seven decimal three seven
alitalia three hundred contact paris on one three three decimal eight two good bye,081_0062,alitalia three hundred contact raris on one three three decimal eight two good bye
roger ill call you back for further climb,071_0632,algirail call you back for further climb
bama one five turn now right direct to zulu uniform echo,051_0178,bama one five turn now right direct to zuro yunifa mecho
roger k l m three four six squawk two seven six six,111_0631,roger k l m three for six squawk two seven six six
lufthansa eight two two one ah milan one three four five two good bye,081_0383,lufthansa eight two two one milan one three four five two good bye
jetaviation seven zero one descend to flight lev ah disregard maintain level three four zero,092_0379,jetaviation seven zero one descend to flight level ah disregard maintain level three four zero
hallo alitalia four one three identified maintain two five zero upon reaching,051_0617,a lu alitalia four one three identified maintain two five zero pon reaching
alright one three three one five please,101_0459,a right one three three one five please
roger what is your position,101_0199,roger ah what is your position
con ah so pick up ah heading of ah one six five,041_0490,con so pick up ah heading of ah one six five
sabena seven eight one six turn r left to nattenheim,061_0581,sabena seven eight turn left to nattenheim
emirates eight one good morning maintain level three three zero trasadingen zurich east to fusse,081_0196,amerids eight one good morning maintain level three three zero trasadingen zurich east to fusle
ah good morning netherlands air force three five in radar contact,012_0117,ah good morning netherlands air force three five fen radar contact
air malta four five zero proceed to zulu uniform echo,111_0754,air malta four five zero proceed to zero uniform echo
bama one five as well milan one three four five two bye bye,091_1049,bama one five suell milan one three four five two bye bye
roger cleared passeiry la tour du pin flight level three zero zero,071_0798,roger cleared ah passeiry la tour du pin flight level three zero zero
k l m three hundred kilo for shortcut turn left by ten degrees,031_0040,k l m three hundred kilo four short cut turn left by ten degrees
austrian four one six whiskey zurich radar good morning identified trasadingen zurich east fusse maintain flight level three four zero,111_0365,austian four one six whiskee zurich radar good morning identified trasadingen zurich east fusse maintain flight level three four zero
airfrans one five five four turn left for heading of zero nine zero,081_0525,airfrans one five five four turn affour heading of zero nine zero
alitalia four eight seven call zurich on one three four decimal six buongiorno,021_0487,alitalia four eight seven call zurich on one three four decimal six bongiurno
luftha sorry speedway three three five two descend to flight level two nine zero,091_1061,lufthans sorry speedway three three five two descend to flight level two nine zero
hapag lloyd one seven one ah geneva one three three one five good bye,092_0241,hapag lloyd one seven one geneva one three three one five good bye
hoi k l m two six four identified,061_0076,mike l m two six four identified
tag malaysian two identified,061_0026,tag malasian two identified
yeah,051_0300,get
speedbird nine four november is your callsign,111_0693,speedbird nine four november as con
lufthansa three five zero eight speed at own convenience contact zurich one three four six tschuss,041_0396,lufthansa three five zero eight speed on convenience contact zurich one three four six tschuss
transavia three zero six three you have been sent to wrong frequency contact rhein one three two decimal four,041_0708,transavia three zero six three of geenscend to rhein frequency contact rhein one three two decimal four
the lufthansa three six zero four is identified climb to flight level two five zero initially,041_0007,be lufthansa three six zero four is identified climb to flight level two five zero initially
aerovic one zero six one call now genev sorry m milan one three four decimal five two bye bye,101_1033,aerovic one zero six one call now genev sorrin milan one three four decimal five two bye bye
k l m two six four for shortcut turn left by ten degrees,031_0050,k l m two six four for short cut turn left by ten degrees
aerovic one zero six one maintain your speed decimal seven five or less,041_0670,aerovic one zero six one maintain your speed decimal seven five four less
lufthansa three five zero eight climb flight level three zero zero expedite climb,041_0378,lufthansa three five zero eight climb flight level three zero zero expetaid climb
air link one three call milan one three four decimal five two bye bye,111_0319,airlink one three call milan one three four decimal five two bye bye
tag belstar five zero two hotel identified,051_0528,trabelsa five zero two hotel identified
aero lloyd five six two proceed from present position to hochwald hotel oscar charlie afterwards to st prex that is sierra papa romeo and then flight planned route,021_0705,aero lloyd five six two proceed from present position to hochwald hotel oscar charlie afterwards to st prex a sierra papa romeo and then flight planned route
india foxtrot golf is identified ill call you back for higher in two minutes,092_0316,india foxtrot golf is identified i call you back for higher in two minutes
tag lufthansa three five zero eight identified maintain two four zero upon reaching ill call you back for higher,031_0327,tag lufthansa three five zero eight identified maintain two four zero pone region ill call you back for eigh
lufthansa eight two six eight expect further climb in about one and a half minute,051_0430,lufthansa eight two six eight expect further climb in about one an haf minute
swissair nine three five nine descend now flight level three three zero descend at two thousand feet per minute or more,011_0310,swissair nine three five nine descend now flight level three three zero descend two thousand feet a minute or more
mission six zero one five three own navigation to tango,101_0714,mitian six zero one five three own navigation to tango
speedway two three five two contact zurich on one three four decimal six good bye,071_0615,abeeduiaey two three five two contact zurich con one three four decimal six good bye
iberia three five three zero good morning radar contact proceed inbound zurich east fusse,101_0256,iberia three five three zero good morning radar contact proceed ingboun zurich east fusse
bye bye,101_0426,ah bye
lufthansa four seven zero zero fly heading two one zero for shortcut,111_0264,lufthansa four seven zero zero fly heading two one zero four so cut
lufthansa four four one six good afternoon radar contact if i give you climb clearance could you make it with ah two thousand,111_0561,lufthansa four four one six good afternoon radar contact if i give you climb clease could you make it with ah two thousand
merair six nine four four contact zurich on one three four six good day,071_0131,meir air six nine four four contact zurich on one three four six good day
bull blue five seven two contact milan one three four five two bye,091_0311,b blue five seven two contact milan one three four five two bye
oh im sorry ah mis ah merair six nine four four maintain three one zero i see your destination sorry maintain three one zero,101_0503,oh am sorry ah missa merair six nine four four maintain three one zero i see your destansation sorry maintain three one zero
ah confirm that tarom three seven four called,031_0641,ah confirm the tarom three seven four could
roger and how do you read now,061_0586,roger and how read now
swissair six five nine descend to flight level two two zero,071_0756,swisair six five nine descend to flight level two two zero
alitalia six four seven four contact ahm rhein control on one two zero nine two bye bye,101_0030,alitalia six four seven four contact and rhein control on one two zero nine two bye bye
iberia two six six three contact zurich on one two five decimal eight five good bye,071_0645,aiberia two six six three contact zurich on one two five decimal eight five good bye
condor nine seven two contact zurich one three three decimal four,111_0645,condar nine seven two contact zurich one three three decimal four
german air force four one four call now geneva one three three one five bye bye,091_1001,german air force four one four contact geneva one three three one five bye bye
cross air five one two ah zurich one two five eight five,081_0092,cross air five one two zurich one two five eight five
jet set one four two nine rhein radar identified,051_0057,jet set one four two nine rheine radar identified
and swissair eight zero six youre cleared from present position to costa which is charlie oscar alfa,011_0209,and swissair eight zero six youre cleared from present position to costa just charlie oscar alfa
air malta four five zero identified route ageri zurich east nelli maintain flight level three two zero,101_0929,air malta four five zero identified route ageri zurich east nelly maintain flight level three two zero
lufthansa eight two two one ah contact milan one three four five two good bye,092_0362,lufthansa eight two two one contact milan one three four five two good bye
emirates zero two four contact milan one three four decimal five two bye bye,101_0946,aimbero zero two four contact milan one three four decimal five two bye bye
olympic one four four proceed direct to kempten,071_0216,olampic one four four proceed direct to kempten
aero lloyd five three three bonjour maintain flight level three four zero kines st prex willisau,071_0630,la five two three bonjour maintaighn flight level three four zero kines st prex willisau
bonjour centennial one five seven identified st prex willisau flight level three two zero,071_0568,bonjour alitalia one five seven identified st prex willisau flight level three two zero
ah air berlin five two five five guten tag identified,031_0166,air berlin five two five five guten tag identified
lufthansa five nine three one good afternoon radar contact maintain flight level three four zero continue present heading until advised,101_0124,lufthansa five nine three one good afternoon radar contact maintain flight level three four zero continue present heading until derised
airlink one three zurich radar good morning identified route trasadingen zurich east fusse maintain flight level three zero zero,092_0009,airlink one three zurich radar good morning identified route trasadingen zurich east busse maintain flight level three zero zero
shamrock four eight six four contact rhein control on one three two decimal four bye bye,111_0389,shemrack four eight six four contact rhein control on one three two decimal four bye bye
egypt air eight eight four is identified,051_0779,egyptair eight eight four is identified
p s a five zero two hotel guten tag identified,061_0566,p s a five zero two ho tel guten tag identified
hallo lufthansa five two nine four radar contact climb flight level three three zero,111_0387,hallo lufthansa five to nine four radar contact climb flight level three three zero
lufthansa four five eight two is identified climb flight level two nine zero,041_0175,lufthansa four five eight two is identified im flight level two nine zero
i f o two two bravo good afternoon squawk seven five three five,101_0756,alfir two two bravo good afternoon squawk seven five three five
alitalia four zero one now youre recleared flight level three three zero the rate of climb at least two thousand,082_0103,alitalia four zero one now your reclair flight level three three zero the rate of climb at least two thousand
onur air nine eight nine guten tag and georgia air zero three seven both identified,051_0456,bonor air nine eight nine guten tag and geoger ah zero three seven both identified
airfrans six seven three four f climb to flight level three five zero,081_0332,airfrans six seven three four climb to flight level three five zero
affirm,051_0220,affa
sobelair two five five seven rhein one through one three two decimal four tschuss,061_0069,sobelair two five five seven rhein one three one three two decimal four tschuss
hapag lloyd one nine five bonjour identified cleared valda passeiry bilsa flight level three four zero,072_0019,hapag lloyd one nine five bonjour identified cleared balda passeiry bilsa flight level three four zero
midland seven two zero call rhein one two seven three seven good day,061_0341,midland seven two zero call rhein one two seven three seven gearding
yeah sabena eight zero one i observe you at flight level two nine zero in the viscinity of romeo mike sierra on a heading you are two nine zero maintaining confirm your level,071_0332,ah sabena eight zero one i p fo at flight level two nine zero in a vicinity of romeo mike sierra on heading you a two nine zero maintaining confirm you level
t w a eight hundred contact milano one two five eight five good bye,071_0634,t lu a eight hundred contact milano one two five eight five good bye
lufthansa four four one six direct saronno,111_0572,lufthansa four four one six direct soronno
three six zero four give me a good rate of climb until passing three two zero please,111_0263,three six zero four ge me good rate of climb until passing three two zero please
alitalia two nin no disregard,061_0492,alitalia two nine no disregard
adria one six two seven guten tag identified,031_0256,ra one six two seven guten tag identified
ukay six two five milano on one two five eight five good bye,071_0476,ukair six two five milan one one two five eight five good bye
and that wasnt air malta calling say again your callsign,111_0752,and ta wasnt or malta calling say again your posi
lufthansa five two nine four good morning radar contact ah recleared flight level three three zero,091_0262,lufthansa five two nine four good morning radar contact and reclair flight level three three zero
oh sorry station calling say again,091_0162,sorry station calling say again
and india sierra alfa climb with one thousand five hundred feet per minute or more,061_0021,and india sierra alfa climb one thousand five hundred feet per minute or more
alitalia four one six good afternoon squawk zero four two zero correction seven five three three sorry,101_0100,alitalia four one six good afternoon squawk zero four two zero correction seven five three three zero
lufthansa five three zero five correct call zurich sector one three three decimal four bye bye,101_0856,lufthansa five three zero five correct call zurich sec one three three decimal four bye bye
sunwing five two one four identified,051_0334,sunwing five two one four time identified
hamburg air two five four six own navigation tour du pin cli contact marseille one two five eight five,071_0490,hamburg air two five four six own navigation tour du pinclin contact marseille one two five eight five
french line nine one six five zurich radar good afternoon identified maintain flight level three three zero trasadingen zurich east fusse,101_0858,french line nine one six five zurich radar good afternoon identified maintain flight level three three zero trasadingen zurich east busse
aerovic one zero six one own navigation st prex contact milan one three four five two good bye,101_0839,avec one zero six one own navigation st prex contact milan one three four five two good bye
delta november alfa proceed via trasadingen canne,101_0510,delta november alfa proceed my trasadingen canne
german air force four nine zero one good afternoon maintain level three four zero trasadingen and st prex,091_0581,german air force four nine zero one good afternoon maintain level three four zero trasadingen st prex
nine seven own navigation to epinal,071_0432,nine seven or own navigation to epinal
good afternoon japan air four one nine radar contact descend flight level two five zero,101_0297,good afternoon jeven air four one nine radar contact descend flight level two five zero
thats correct stand that routing,101_0009,thats correct stand a routing
negative to the right heading zero one five,101_0662,negative to to right heading zero one five
ah tarom three seven four for separation turn left heading one zero five,041_0636,matarom three seven four for separation turn left heading one zero five
hapag lloyd six five three contact zurich one three four decimal six,051_0037,hapag lloeight six five three contact zurich one three four decimal six
yeah,031_0688,a
roger sir recleared flight level three one zero thank you for your help,031_0151,roger s a recleared flight level three one zero thank you fi your hap
thank you,041_0667,sankoir
speedbird five six three contact radar on one two eight decimal one five good bye,081_0026,speedbird five six three contact radar on one two is decimal one five good bye
turkish five one five contact rhein one two seven three seven tschuss,061_0140,tag a five one five contact rhein one two seven three seven tschuss
sabena eight zero one ah rhein identified,071_0306,sabena eight zero one rhein identified
georgia air zero three seven rhein radar identified,051_0041,george air zero three seven rhein radar identified
alright thank you very much further climb radar one three three point four bye,091_0810,alright thank you air moch further climb radar one three three point four bye
balkan four three one contact ah reims on one three four four bye,101_0024,balkan four three one contact reims on one three four four bye
iberia three five three zero continue descent to flight level two nine zero,111_0654,iberia three five three zero continue descend to flight level two nine zero
hapag lloyd six five three rhein radar identified climb flight level two seven zero,051_0018,hapag lloeight six five three rhein radar identified climb flight level two seven zero
co,071_0788,cot
yeah,071_0309,a
bonjour berlin five zero eight one cleared direct la tour du pin flight level three three zero,081_0076,bonjour berlin five zero eight one cleared ah direct la tour du pin flight level three three zero
ah alitalia four eight five good morning roger,081_0354,alitalia four eight five good morning roger
and four two zero nine expect an initial descent in about two minutes from now,031_0241,and four two zero nining speekt an initial descent in about two minutes from now
good afternoon israeli air force four four two maintain level three five zero,101_0825,good afternoon israeliar force four four two maintain level three five zero
tag jet set one four two nine identified,051_0477,tag jet see one four two nine identified
emirates eight one good morning maintain level three three zero trasadingen zurich east to fusse,091_0540,emeroits eight one good morning maintain level three three zero trasadingen zurich east to fusse
alitalia two nine two radar contact trasadingen karlsruhe climb flight level three two zero,082_0079,alitalia two nine two radar contact trasadingen kasruhe climb flight level three two zero
delta mike echo good afternoon call you back,101_0790,delfa mike co good afternoon call you back
tarom three seven four is identified maintain the heading,051_0740,tam three seven four is identified maintain the heading
alitalia three zero one bonjour cleared passeiry torino flight level three three zero,081_0008,alitalia three zero bonjour cleared passeiry torino flight level three three zero
swissair four eight eight turn right heading of ah zero eight zero,082_0044,swissair four eight eight turn right heading of zero eight zero
roger delta november alfa maintain heading after passing neckar,011_0312,roger delta november alfa maintain heading after passing neco
affirm,041_0610,affi
cross air eight five eight call rhein on ah one two seven three seven good day,071_0097,cross air eight five eight call rhein on one two seven three seven good day
shamrock four eight two two descend flight level three zero zero,091_0904,sharak four eight two two descend flight level three zero zero
scandinavian six eight six contact rhein one three two decimal four hejda,091_0021,scandinavian six eight six contact rhein one three two decimal four aero
belstar five two six hotel proceed direct to kempten kilo papa tango,061_0121,belsa five two six hotel proceed direct to kempten kilo papa tango
merair six nine four four is identified,051_0772,air six nine four four is identified
k l m three four six good morning identified,012_0181,k l a three four six good morning identified
emirates eight one contact milan one three four five two bye,111_0456,ameras eight one contact milan one three four five two bye
hotel tango romeo schonen tag identified,061_0401,hotel tango romeo fine on tag identified
scandinavian s scandinavian six one four set course direct frankfurt,111_0400,scandinavians scandinavia six one four set course direct frankfurt
delta mike echo fly direct to karlsruhe climb flight level two seven zero now,031_0251,delta mike echo fly direct to karlsruh climb flight level two seven zero now
k l m three four six to stay clear later on french military air space turn right heading three five zero,031_0202,k l m three four six to say cleared later now french military airspese turn right heading three five zero
tag speedbird one two nine identified,021_0206,tag sbeel one two nine identified
delta november alfa fly heading one eight five,011_0371,delta november alfa fly heading ng one eight five
europa three six one now direct tango and contact rhein control on one three two four bye bye,091_0518,europa three six one ah now direct tango and contact rhein control on one three two four bye bye
luftha,091_0864,lufthans
olympic one four four rhein radar one three two decimal four,031_0048,olampic one four four rhein radar one three two decimal four
shamrock four eight two two contact milan one three four decimal five two good day,091_0186,gemrock four eight two two contact milan one three four decimal five two good day
spar eight nine nine contact marseille on one two five decimal eight five good bye,071_0758,spar eight nine contact marseille on one two five decimal eight five good bye
turkish five one five rhein identified,011_0108,turkash five one five rhein identified
