transcription,recording_id,model_transcription
aerovic one zero six one turn immediately right heading ah two one five ,092_0092,aerovic one zero six one turn immediately right heading ah two one five
lufthansa five three zero five further right heading zero one five ,101_0661,lufthansa five three zero five further right heading zero one five
swissair four eight eight turn right heading of ah zero eight zero ,082_0044,swissair four eight eight turn right heading of zero eight zero
alitalia one one seven descend to flight level two five zero ,092_0303,alitalia one one seven descend to flight level two five zero
alitalia two nine one turn now right to tango romeo alfa ,051_0795,alitalia two nine one turn now right to tango romeo alfa
aero lloyd five one seven ah due traffic turn right one zero degrees ,101_0616,aero lloyd five one seven ah due traffic turn right one zero degrees
contact geneva one three three one five tschuss ,081_0869,contact geneva one three three one five tschuss
airfrans ah disregard ,081_0774,airfrans ah disregard
alitalia three six nine turn right to herbi intersection ,041_0160,alitalia three six nine turn right to herbi intersection
alitalia one one seven rhein radar identified ,051_0039,alitalia one one seven rhein radar identified
alitalia three two four contact reims one three four four bye ,101_0463,alitalia three two four contact reims one three four four bye
alitalia one four nine turn right one five degrees ,061_0337,alitalia one four nine turn right one five degrees
shamrock four eight two two just clear of traffic now descend to flight level two five zero ,091_0679,shamrock four eight two two just clear of traffic now descend to flight level two five zero
jetcom one three three your rate of climb ,111_0447,jetcom one three three your rate of climb
condor one zero four good morning squawk seven five three one ,081_0524,condor one zero four good morning squawk seven five three one
hotel bravo india tango romeo climb now to flight level three six zero ,012_0232,hotel bravo india tango romeo climb now to flight level three six zero
delta mike echo proceed to trasadingen ,031_0676,delta mike echo proceed to trasadingen
alitalia four eight seven is in radar contact confirm level three four zero ,041_0496,alitalia four eight seven is in radar contact confirm level three four zero
lufthansa three five six six zurich radar good morning youre identified route trasadingen saronno ill call you back for further climb ,091_1043,lufthansa three five six six zurich radar good morning youre identified route trasadingen saronno ill call you back for further climb
roger call you back ,101_0074,roger call you back
confirm three five five ,031_0621,confirm three five five
airfrans three five six roger continue climb flight level three one zero for the time ,091_0369,airfrans three five six roger continue climb flight level three one zero for the time
roger delta november alfa maintain heading after passing neckar ,011_0312,roger delta november alfa maintain heading after passing neco
lufthansa three six three eight climb flight level three three zero ,011_0160,lufthansa three six three eight climb flight level three three zero
affirm ,041_0610,affi
golf juliett india contact zurich one three three decimal four ,051_0272,golf juliett india contact zurich one three three decimal four
four four one six climb flight level three one zero ,021_0095,four four one six climb flight level three one zero
cross air eight five eight call rhein on ah one two seven three seven good day ,071_0097,cross air eight five eight call rhein on one two seven three seven good day
lufthansa four two one nine turn left to delta kilo bravo ,041_0730,lufthansa four two one nine turn left to delta kilo bravo
tag lufthansa four five eight two identified ,041_0366,tag lufthansa four five eight two identified
lufthansa triple three zero is identified climb to flight level two five zero initially ,021_0694,lufthansa triple three zero is identified climb to flight level two five zero initially
shamrock four eight two two descend flight level three zero zero ,091_0904,sharak four eight two two descend flight level three zero zero
scandinavian six eight six contact rhein one three two decimal four hejda ,091_0021,scandinavian six eight six contact rhein one three two decimal four aero
belstar five two six hotel proceed direct to kempten kilo papa tango ,061_0121,belsa five two six hotel proceed direct to kempten kilo papa tango
merair six nine four four is identified ,051_0772,air six nine four four is identified
alitalia one five zero good afternoon squawk two seven four five ,101_0897,alitalia one five zero good afternoon squawk two seven four five
belstar five zero two hotel rhein one three two four ,041_0513,belstar five zero two hotel rhein one three two four
k l m three four six good morning identified ,012_0181,k l a three four six good morning identified
emirates eight one contact milan one three four five two bye ,111_0456,ameras eight one contact milan one three four five two bye
french air force four four one zero zurich radar good morning identified maintain flight level three four zero trasadingen zurich east fusse ,091_1068,french air force four four one zero zurich radar good morning identified maintain flight level three four zero trasadingen zurich east fusse
britannia two three six alfa turn right to trasadingen ,021_0502,britannia two three six alfa turn right to trasadingen
p s a five two six hotel contact rhein one three two decimal four ,071_0271,p s a five two six hotel contact rhein one three two decimal four
roger fly heading three three zero ,021_0452,roger fly heading three three zero
k l m three hundred kilo contact rhein one two seven three seven tschuss ,061_0090,k l m three hundred kilo contact rhein one two seven three seven tschuss
transwede one zero seven geneva one three three one five bye ,081_0649,transwede one zero seven geneva one three three one five bye
swissair nine three five two contact rhein one two seven decimal three seven ,051_0020,swissair nine three five two contact rhein one two seven decimal three seven
roger ,031_0148,roger
alitalia one four nine turn right by ten degrees ,031_0132,alitalia one four nine turn right by ten degrees
swissair five correction swissair nine three five nine continue descent now flight level two nine zero two thousand feet per minute or more ,041_0343,swissair five correction swissair nine three five nine continue descent now flight level two nine zero two thousand feet per minute or more
belstar five zero two hotel contact rhein one three two four tschuss ,051_0551,belstar five zero two hotel contact rhein one three two four tschuss
golf juliett india report your heading ,031_0212,golf juliett india report your heading
alitalia one one nine radar contact ,012_0068,alitalia one one nine radar contact
affirm ,051_0813,affirm
aero lloyd five nine zero rhein identified climb flight level two nine zero ,021_0048,aero lloyd five nine zero rhein identified climb flight level two nine zero
roger ,051_0739,roger
merair six nine five two contact zurich one three four six ,021_0291,merair six nine five two contact zurich one three four six
delta sierra alfa contact rhein one two seven decimal three seven ,061_0506,delta sierra alfa contact rhein one two seven decimal three seven
transwede one zero seven geneva one three three one five bye ,091_0871,transwede one zero seven geneva one three three one five bye
airfrans three two six one turn left heading two five five ,091_0550,airfrans three two six one turn left heading two five five
roger ,101_0434,roger
belgian airforce four four is identified ,051_0734,belgian airforce four four is identified
delta seven six milan one three four five two good bye ,091_0726,delta seven six milan one three four five two good bye
delta mike echo report your rate of climb ,051_0803,delta mike echo report your rate of climb
hapag lloyd six five three climb with one thousand five hundred feet per minute or more ,051_0451,hapag lloyd six five three climb with one thousand five hundred feet per minute or more
k l m three hundred kilo rhein one two seven three seven ,061_0558,k l m three hundred kilo rhein one two seven three seven
hotel tango romeo schonen tag identified ,061_0401,hotel tango romeo fine on tag identified
airfrans one five five four milan one three four five two good bye ,092_0256,airfrans one five five four milan one three four five two good bye
roger further contact milan one three four five two bye ,082_0157,roger further contact milan one three four five two bye
viva nine zero eight one descend to flight level two nine zero ,092_0293,viva nine zero eight one descend to flight level two nine zero
is algerie two zero seven three on frequency ,041_0720,is algerie two zero seven three on frequency
hapag lloyd one one two rhein one two seven three seven tschuss ,061_0398,hapag lloyd one one two rhein one two seven three seven tschuss
scandinavian s scandinavian six one four set course direct frankfurt ,111_0400,scandinavians scandinavia six one four set course direct frankfurt
alitalia four eight five rhein radar identified ,061_0540,alitalia four eight five rhein radar identified
sunwing five two one two climb flight level three four zero ,101_0242,sunwing five two one two climb flight level three four zero
climb to flight level three eight zero ,071_0889,climb to flight level three eight zero
fox oscar kilo sierra india continue climb to level three four zero ,041_0417,fox oscar kilo sierra india continue climb to level three four zero
tag lufthansa four two zero nine identified ,061_0404,tag lufthansa four two zero nine identified
delta mike echo fly direct to karlsruhe climb flight level two seven zero now ,031_0251,delta mike echo fly direct to karlsruh climb flight level two seven zero now
alitalia four zero one rhein radar identified climb ah flight level ah two nine zero ,061_0548,alitalia four zero one rhein radar identified climb ah flight level ah two nine zero
transwede one zero seven climb flight level three three zero ,031_0425,transwede one zero seven climb flight level three three zero
airfrans one five five four good morning descend to flight level three three zero rate two thousand or more ,092_0231,airfrans one five five four good morning descend to flight level three three zero rate two thousand or more
k l m three four six to stay clear later on french military air space turn right heading three five zero ,031_0202,k l m three four six to say cleared later now french military airspese turn right heading three five zero
tag speedbird one two nine identified ,021_0206,tag sbeel one two nine identified
turkish nine two five radar contact flight planned route ,111_0577,turkish nine two five radar contact flight planned route
hapag lloyd one one two contact rhein one two seven three seven tschuss ,041_0237,hapag lloyd one one two contact rhein one two seven three seven tschuss
swissair nine three six zero contact rhein radar one two seven decimal three seven ,041_0009,swissair nine three six zero contact rhein radar one two seven decimal three seven
lufthansa four two zero seven is identified ,051_0217,lufthansa four two zero seven is identified
aero lloyd five six two is identified climb to flight level two nine zero ,021_0678,aero lloyd five six two is identified climb to flight level two nine zero
merair six nine four four contact now zurich one three four decimal six ,041_0722,merair six nine four four contact now zurich one three four decimal six
delta november alfa fly heading one eight five ,011_0371,delta november alfa fly heading ng one eight five
viva five eight five report your heading ,012_0074,viva five eight five report your heading
merair six nine five two milan one three four decimal five two bye bye ,101_1042,merair six nine five two milan one three four decimal five two bye bye
europa three six one now direct tango and contact rhein control on one three two four bye bye ,091_0518,europa three six one ah now direct tango and contact rhein control on one three two four bye bye
transwede one zero seven direct st prex ,111_0495,transwede one zero seven direct st prex
cross air eight five eight contact rhein frequency one two seven three seven tschuss ,021_0262,cross air eight five eight contact rhein frequency one two seven three seven tschuss
luftha ,091_0864,lufthans
alitalia one five eight good morning squawk five seven two zero ,091_0982,alitalia one five eight good morning squawk five seven two zero
gulf air zero zero five is identified good morning ,012_0274,gulf air zero zero five is identified good morning
olympic one four four rhein radar one three two decimal four ,031_0048,olampic one four four rhein radar one three two decimal four
lufthansa three five five six turn right to trasadingen ,051_0133,lufthansa three five five six turn right to trasadingen
good afternoon sunwing five two one two radar contact continue as cleared ,101_0495,good afternoon sunwing five two one two radar contact continue as cleared
lufthansa four four zero eight own navigation st prex ,111_0215,lufthansa four four zero eight own navigation st prex
one three four five two correct bye bye ,111_0320,one three four five two correct bye bye
olympic one four four contact rhein one three two decimal four ,011_0062,olympic one four four contact rhein one three two decimal four
shamrock four eight two two contact milan one three four decimal five two good day ,091_0186,gemrock four eight two two contact milan one three four decimal five two good day
lufthansa four four one six good afternoon maintain level three hundred ,091_0693,lufthansa four four one six good afternoon maintain level three hundred
spar eight nine nine contact marseille on one two five decimal eight five good bye ,071_0758,spar eight nine contact marseille on one two five decimal eight five good bye
alitalia four eight five descend to flight level ah three one zero ,091_0202,alitalia four eight five descend to flight level ah three one zero
lufthansa four three seven six good morning climb to flight level two nine zero ,061_0331,lufthansa four three seven six good morning climb to flight level two nine zero
and four three seven six proceed direct trasadingen ,051_0580,and four three seven six proceed direct trasadingen
lufthansa three six zero four proceed direct trasadingen ,041_0225,lufthansa three six zero four proceed direct trasadingen
turkish five one five rhein identified ,011_0108,turkash five one five rhein identified
blue five seven two set course direct canne ,081_0464,blue five seven two set course direct canne
swissair eight zero six proceed now own navigation to nattenheim ,051_0201,swissair eight zero six proceed now own navigation to nattenheim
transwede one zero seven climb to flight level three three zero ,111_0133,transwede one zero seven climb to flight level three three zero
i say again malaysian four contact rhein radar one two seven decimal three seven ,051_0343,saigan malaysian four contact rhein radar one two seven decimal three seven
lufthansa eight two six eight ah three one zero is final level due traffic ah you may set course direct to olben ,092_0166,lufthansa eight two six eight ah three one zero is final level due traffic ah you may set course direct to olben
aero lloyd five one seven bonjour identified cleared kines st prex willisau flight level three two zero ,071_0355,aero lloyd five one seven bonjour identified cleared kines st prex willisau flight level three two zero
delta echo bravo climb to flight level four one zero ,101_0872,delta echo bravo climb to flight level four one zero
sabena eight three zero proceed to gotil ,041_0569,sabena eight three zero proceed to gotil
alitalia three six nine can you increase your speed to decimal seven five or more ,031_0737,alitalia three six nine can you increase your speed to decimal seven five or more
tag sabena eight three six identified ,061_0405,tag sabena eight three six identified
french line nine one six three fly heading zero nine five until advised ,091_1014,french line nine one six three fly heading zero nine five until advised
lufthansa four two one nine is identified youre cleared direct to delta kilo bravo ,021_0689,lufthansa four two one nine is identified youre cleared direct to delta kilo bravo
swissair four eight eight good morning maintain two eight zero when reaching call you back for higher ,101_0586,swissair four eight eight good morning maintain two eight zero and reation call you back for higher
hapag lloyd one seven one contact geneva one three three one five bye bye ,111_0477,hapag lloyd one seven one contact geneva one three three one five bye bye
lufthansa four three five six climb to flight level three two zero ,091_0025,lufthansa four three five six climb to flight level three two zero
k l m three four s six report your heading ,021_0545,k l m three four s six report your heading
midland seven two zero contact rhein one two seven three seven ,011_0139,midland seven two zero contact rhein one two seven three seven
tag belstar five oh two hotel identified ,061_0119,tag belsa five oh two hotel identified
alitalia one three five is identified ,041_0125,alitalia one three five is identified
hapag lloyd one seven one geneva one three three one five good bye ,111_0069,hapag lloyd one seven one geneva one three three one five good bye
ah okay ,041_0688,ah okay
lufthansa five five zero four contact geneva milan one three four five two bye ,101_0449,lufthansa five five zero four contact geneva ohh milan one three four five two bye
merair six nine four four climb to flight level three three zero ,101_0810,merair six nine four four climb to flight level three three zero
netherlands air force four one four descend flight level three two zero expedite descent as crossing traffic ,071_0257,netherlands air force four one four descend flight level three two zero expet i descent as crossing traffic
yeah ,021_0031,a
lufthansa five five zero four zurich radar good morning identified trasadingen to s fribourg maintain flight level three three zero ,092_0046,lufthansa five five zero four zurich radar good morning identified trasadingen to s fribo maintain flight level three three zer
merair six nine five two fly heading one eight five climb flight level two nine zero ,051_0292,merair six nine five two fly heading one eight five climb flight level two nine zero
lufthansa four two zero seven contact rhein radar one three two decimal four ,021_0574,lufthansa four two zero seven contact rhein radar one three two decimal four
aero lloyd five nine zero rhein radar identified climb flight level two nine zero ,011_0065,aero lloyd five nine zero rhein radar identified climb flight level two nine zero
aero lloyd five nine zero good morning radar contact maintain flight level three one zero trasadingen canne ,091_0437,aero lloyd five nine zero good morning radar contact maintain flight level three one zero trasadingen canne
lufthansa four six five two bonjour identified cleared passeiry la tour du pin flight level three zero zero stand by for higher ,072_0175,ftansa four six five two bonjour identified cleared pasreela tour du pin flight level three zero zero stand by for higher
saudia three four one good morning maintain flight level three three zero got radar contact ,081_0553,sauda three four one good morning maintain flight level three three zero go radar contact
britannia triple two alfa rhein radar identified ,031_0094,britannia triple two alfa rhein radar identified
jet set two zero seven ah turn left direct to hochwald ,101_0516,jet set two zero seven ah turn left direct to hochwald
cross air six eight six contact marseille one two five eight five good bye ,071_0746,sair six eight six contact marseille one two five eight five good bye
jet set four four two good morning radar contact turn right by one five degrees and descend flight level three three zero ,081_0581,jet set four four two good morning radar contact turn right by one five degrees and descend flight level three three zero
united six nine milan one three four five two good bye ,081_0365,united six nine milan one three four five two good bye
swissair nine three five two call rhein on one two seven three seven good day ,041_0420,swissair nine three five two call rhein on one two seven three seven good day
adria one six two seven contact rhein radar one three two decimal four ,041_0651,adria one six two seven contact rhein radar one three two decimal four
golf bravo victor juliett india is identified good afternoon ,051_0227,goll bravo victor juliett india is identified good afternoon
steel eighty eight is identified ,012_0285,steel eighty eight is identified
india yankee juliett ,081_0629,india yankee juliett
airfrans one five five four contact milan one three four five two good bye ,091_0118,airfrans one five five four contact milan one three four five two good bye
sobelair two five five seven contact rhein one three two decimal four ,061_0524,sobelair two five five seven contact rhein one three two decimal four
delta november alfa good afternoon radar contact maintain two nine zero call you back ,101_0507,delta november alfa good afternoon radar contact maintain two nine zero call you back
lufthansa triple three zero climb to flight level three one zero ,071_0167,lufthansa triple three zero climb to flight level three one zero
jetaviation seven zero one direct ah fribourg ,081_0709,jetaviation seven zero one direct affriebourg
lufthansa five two three six good afternoon radar contact ,071_0022,lufthansa five two three six good afternoon radar contact
lufthansa four three nine three good morning radar contact ,092_0229,lufthansa four three nine three good morning radar contact
tarom three seven four proceed direct to tango ,061_0449,tarom three seven four proceed direct to tango
air malta four five zero ah disregard ,111_0308,air malta four five zero ah disregard
air algerie two zero seven three is identified turn right to trasadingen climb flight level two seven zero ,051_0809,air algerie two zero seven three is identified turn right to trasadingen climb flight level two seven zero
gulf air zero zero five good afternoon radar contact ,071_0086,alfair zero zero five good afternoon radar contact
alitalia one one nine own navigation saronno milan one three four five two ciao ,081_0392,alitalia one one nine own navigation saronno milan one three four five two ciao
malaysian two rhein radar identified ,051_0026,malaysian two rhein radar identified
alitalia four six nine reduce to decimal seven seven or less ,031_0733,alitalia four six nine reduce to decimal seven seven or less
good morning blue five seven two radar contact continue descent to flight level two five zero ,081_0463,good morning blue five seven two radar contact continue descent to flight level two five zero
berlin five two five five rhein one two seven three seven tschuss ,041_0219,berlin five two five five rhein one two seven three seven tschuss
alitalia one five zero youre identified route trasadingen to karlsruhe climb to flight level three one zero ,091_1051,alitalia one five zero youre identified route trasadingen to karlsruhe climb to flight level three one zero
jetcom one three three ah disregard ,101_0557,jetcom one three three ah disregard
lufthansa eight two six eight fly heading one eight zero ,021_0362,lufthansa eight two six eight fly heading one eight zero
p s a five two six hotel contact rhein one three two decimal four ,051_0112,p s a five two six hotel contact rhein one three two decimal four
lufthansa eight two six eight contact zurich one three four six tschuss ,051_0444,lufthansa eight two six eight contact zurich one three four six tschuss
iberia three five three zero contact milan one three four five two adios ,101_0685,iberia three five three zero contact milan one three four five two adios
nato one zero contact rhein radar one two seven decimal three seven ,041_0700,nato one zero contact rhein radar one two seven decimal three seven
europa three six one good morning radar contact maintain flight level three four zero heading of five zero three five ,091_0484,europa three six one good morning radar contact maintain flight level three four zero heading of five zero three five
ah roger call you back ,101_0114,ah roger call you back
lufthansa three five five six zurich on one three four six ,012_0146,lufthansa three five five six zurich on one three four six
alitalia one five zero roger squawk two seven four five ,101_0047,alitalia one five zero roger squawk two seven four five
correction k l m three four six left turn ten degrees ,071_0017,correction k l m three four six left turn ten degrees
lufthansa three five six six climb to flight level three one zero ,111_0721,lufthansa three five six six climb to flight level three one zero
air malta one zero four for climb clearance contact radar one three three point four bye bye ,101_0128,air malta one zero four for climb clearance contact radar one three three point four bye bye
alitalia four one three direct to trasadingen ,051_0626,alitalia four one three direct to trasadingen
lufthansa three five si six six contact zurich one three four six tschuss ,031_0204,lufthansa three five six six six contact zurich one three four six tschuss
netherlands air force four one four descend with two thousand feet per minute or more ,051_0523,netherlands air force four one four descend with two thousand feet per minute or more
lufthansa eight two six eight now proceed direct to trasadingen ,061_0202,lufthansa eight two six eight now proceed direct to trasadingen
sunwing five two one two contact zurich one three four decimal six ,031_0756,sunwing five two one two contact zurich one three four decimal six
