transcription,recording_id,model_transcription
lufthansa eight two six eight for further climb zurich one three three decimal four good bye ,091_0564,lufthansa eight two six eight four for climb zurich one three three decimal four bye
foxtrot sierra india contact milan one three four five two good bye ,091_0104,foxtrot sierra india contact milan one three four five two good bye
bonjour alitalia three one seven cleared passeiry torino flight level two nine zero ,081_0149,bonsualita la three one seven cadpaierri torino flight eble two nine zero
hapag lloyd six five three contact zurich one three four decimal six ,071_0208,hapag lloyd six five three contact zurich one three four decimal six
olympic one four four rhein identified ,021_0020,olympic one four four rhein identified
algerie two zero seven three is identified fly heading two zero five climb flight level two seven zero ,041_0723,algerie two zero seven three is identified fly heading two zero five climb flight level two seven zero
sabena eight three six rhein one two seven three seven tschuss ,021_0248,sabena eight re six rhein one to seven three seven trees
sabena nine seven zero climb to flight level three two zero ,072_0029,sabena nine seven zero climb to flight able three two zero
oh sorry station calling say again ,091_0162,sorry station calling again
viva nine zero eight one turn left heading three five zero ,071_0399,vivanan zero eight one one left heading three five zero
sabena seven eight one six contact rhein one two zero nine two good bye ,111_0040,sabena seven eight one six contact rhein one two zero nine two good bye
and india sierra alfa climb with one thousand five hundred feet per minute or more ,061_0021,in india sierra alfa climb one thousand five hundred feet per minute or more
alitalia four one six good afternoon squawk zero four two zero correction seven five three three sorry ,101_0100,alitalia four one six good afternoon squawk zero four two zero correction seven five three three zero
sabena nine three six nine radar contact ,061_0316,sabena nine three six nine radar contact
belstar five zero two hotel contact rhein one three two four good day ,021_0475,belstar five so two hotel contact line one three two four good day
lufthansa five three zero five correct call zurich sector one three three decimal four bye bye ,101_0856,ufthansa five three zero five correct auserix sector one three three decimal four bye bye
alitalia one five zero good afternoon identified report your heading ,031_0620,alitalia one five zero good afternoon identified report a heading
aero lloyd five six zero geneva one three three one five good bye ,081_0235,aerolold five six zero geneva one three three one five
lufthansa five five zero four good afternoon radar contact trasadingen fribourg ,101_0411,lufthansa five five zero four good afternoon radar contact trasading freebuug
tag tunis air four eight zero two identified ,031_0309,tag tunis air four eight zero two identified
german air force four nine zero one good afternoon roger ,081_0749,german air force four nine zero one good afternoon rate
indialook climb flight level two nine zero ,061_0392,in a lu climb flight level two nine zero
affirm swissair nine three six zero contact rhein radar one two seven decimal three seven ,051_0215,affirm swissair nine three six zero contact rhein radar one two seven decimal three seven
united six nine turn ah left one zero degrees ,092_0322,united six nine turn ah left one zero degrees
sunwing five two one four identified ,051_0334,sanning five two one four turn by identified
speedway three four six nine good afternoon maintain level three hundred ,081_0784,speedway three four six nine good afternoon maintain level three hundred
oscar hotel india call rhein on one three two four ,012_0132,oscar hotel india call rhein on one three two four
k l m three four six climb to flight level three two zero maintain heading ,051_0222,galiam three four six climb to flight level three two zero maintain heading
hamburg air two five four six own navigation tour du pin cli contact marseille one two five eight five ,071_0490,hamburg a two five four six own navigation two depankla contact marsei one to five egt five
french line nine one six five zurich radar good afternoon identified maintain flight level three three zero trasadingen zurich east fusse ,101_0858,french line nine one six five zuri radar good afternoon identified maintain flight level three three zero translading in zuri ge east fusse
airfrans three five six calling ,081_0268,airfrans three five six calling
tag ,031_0183,tag
aerovic one zero six one own navigation st prex contact milan one three four five two good bye ,101_0839,eva c one zero six one own navigation up re contact milan one three four five two good bye
delta november alfa proceed via trasadingen canne ,101_0510,delta november alfa proceed my trasad in canne
alitalia four zero one climb flight level three one zero ,091_0894,alitalia four zero one climb flight level three one zero
jetaviation seven zero one ah radar contact descend flight level three zero zero ,091_0494,generation seven zero one radar contact descend flight level three zero zero
foxtrot sierra india contact milan one three four five two good bye ,091_0624,fox out sierra india contact milan one three four five two good bye
sabena eight two six alfa own navigation trasadingen ,081_0612,sabena eight two six alfa own navigation trasading
transwede three five seven one contact reims one three four decimal four bye bye ,091_0327,transwede three five seven one cantact reims one three four decimal four bye bye
good morning lufthansa three five five six radar contact maintain flight level two nine zero and proceed trasadingen canne ,082_0142,good morning lufthansa three five five six radar contact maintain flight level two nine zero and des proceed tran heading canne
lufthansa eight two six eight climb flight level three seven zero ,031_0013,lufthansa eight two six eight climb flight level three seven zero
sabena eight three zero contact rhein one two seven three seven tschuss ,041_0231,sabena eight three zero contact rhein one two seven three seven treos
german air force four nine zero one good afternoon maintain level three four zero trasadingen and st prex ,091_0581,german air force four nine zero one good afternoon maintain level three four zero trustingenson prex
scandinavian six one seven descend to flight level two nine zero ,031_0645,scaninavian six one seven descend to flight level two nine zero
lufthansa four three nine zero identified climb flight level two seven two nine zero ,011_0167,lufthansa four three nine zero identified climb flight level two seven two nine zero
nine seven own navigation to epinal ,071_0432,nansevano own navigation two epinal
good afternoon japan air four one nine radar contact descend flight level two five zero ,101_0297,good afternoon japan air four one nine radar contact descend flight level two five zero
lufthansa eight two six eight heading one eight zero ,012_0019,lufthansa eight two six eight heading one eight zero
speedbird two two three direct to nattenheim november tango mike ,051_0569,speedbird two two three direct to nattenheim november tango mike
jetcom one three three climb to flight level three five zero ,091_0083,jetcom one three three climb to flight level three five zero
thats correct stand that routing ,101_0009,thats correct stand at routing
negative to the right heading zero one five ,101_0662,negative two to right heading zero one five
algerie two zero seven three continue climb to flight level two nine zero ,031_0703,algerie two zero seven three continue climb to flight level two nine zero
alitalia two nine two good morning squawk two seven six one ,082_0072,alitalia two nine two ah morning squawk two seven six one
ah tarom three seven four for separation turn left heading one zero five ,041_0636,a tarom three seven four for separation turn left heading one zero five
tag belgian airforce four four identified report your heading ,061_0426,tag belgian airforce four four identified report or heading
lufthansa three five five zero climb to flight level two nine zero ,021_0586,lufthansa three five five zero climb to flight level to nine zero
swissair six five two zero rhein one two zero nine two good bye ,091_0537,spesia six five two zero rhein one two zero nine two good bye
airfrans six seven zero zurich radar good morning descend to flight level three three zero ,092_0019,airfrans six seven zero zerigwadar good morning descend to flight level three three zero
alitalia three six five bonjour cleared passeiry torino maintain flight level three four zero ,071_0881,alitalia three six five bongoe clear passe retoreno maintain flight level three four so
netherlands air force four one four contact zurich one three four six tschuss ,061_0122,nevaleans air force four one four contact zurich one three four six three
delta november alfa affirm and fly heading one seven zero ,031_0674,delta no we a alfa affirm and fly heading one seven zero
hapag lloyd three five five one direct canne contact milan one three four five two bye ,091_0956,haboloigt three five five one direct canne consamilan one three four five two bye
lufthansa three six zero four ,041_0241,lufthansa three six zero four
contact milan one three four five two good bye ,101_0584,contact milan one three four five two good bye
jetcom one three three for further climb zurich one three three decimal four good bye ,111_0037,jetcom one three three four four to climb zurich one three three decimal four good bye
transwede one zero one contact zurich one three three decimal four ,031_0400,transwede one zero one contact zurich one three three decimal four
hapag lloyd six five three contact zurich one three four decimal six ,051_0037,hapag lloyd six five three contact zurich one three four decimal six
yeah ,031_0688,yeah
hapag lloyd six five three good morning radar contact ill call you back with higher ,081_0951,hap ali six five three good morning radar contact i call you back a higher
cross air five one eight rhein one three two decimal four ,092_0107,cross air five one eight rhein one three two decimal four
lufthansa four four zero eight climb to flight level three one zero ,101_0670,lufthansa four four zero d climb to flight level three one zero
negative speedbird two three three contact rhein one two seven three seven ,071_0313,negative speedbeard two three three contact rhein one two seven three seven
jet set four four two contact milan one three four five two bye ,091_0883,just said four four two can of milan one three four five two bye
lufthansa four seven two three good morning roger ,081_0203,lufthansa four seven two three good morning rogiar
lufthansa four seven two three ,091_0286,lufthansa four seven two three
alitalia two six two climb to flight level three two zero ,071_0470,italia two six two climb to flight level three two zero
air malta one hundred squawk five seven one seven ,091_0874,a malta one hundred squawk five seven one seven
lufthansa four six five two good morning roger ,081_0334,lufthansa four six five two good morning rotiar
speedway three three five two milan one three four five two bye bye ,101_0734,speedway three three five two milan one three four five two bye
three six zero four correct climb to flight level three four zero ,101_0922,three six zero four correct climb to flight level three four zero
roger sir recleared flight level three one zero thank you for your help ,031_0151,roge au recleat flight level three one zero thank you for your help
malaysian four contact rhein one two seven three seven good day ,071_0112,malaysian four contact rhein one two seven three seven good day
thank you ,041_0667,thank you
malaysian two radar contact ,041_0423,malaysian two radar contact
alitalia four zero one climb flight level three three zero ,111_0569,alitalia four zero one climb flight level three three zero
lufthansa three five six six climb now to flight level three seven zero ,021_0550,lufthansa three five six six climb now to flight level three seven zero
speedbird five six three contact radar on one two eight decimal one five good bye ,081_0026,speedbald five six three contact radar on one two eight decimal one five good bye
georgia zero three seven rhein radar identified ,071_0210,georgia zero three seven rhein radar identified
jetaviation seven zero one good morning squawk two seven three two ,092_0353,jetdevasion seven zero one good morning squawk two seven three two
lufthansa three five six six direct to trasadingen ,061_0363,lufthansa three five six six direct to trasadingen
and six nine four four proceed direct to trasadingen ,031_0281,and six nine four four proceed direct to trasadingen
austrian four one one ,081_0349,austrian four one one
air malta zero zero four radar contact ,041_0441,air malta zero zero four radar contact
europa three six one good morning radar contact ,091_0193,ropa three six one good morning radar contact
condor one zero four climb to flight level three three zero ,081_0273,condo one zero four climb to flight level three three zero
alitalia two nine one good morning identified trasadingen saronno maintain flight level three three zero ,111_0333,alitalia two nine one good morning identified reading zero no maintain flight level three three zero
contact milan one three four five two good bye ,092_0185,contact milan one three four five two good bye
turkish five one five contact rhein one two seven three seven tschuss ,061_0140,turkish five one five contact rhein one two seven three seven trees
delta india charlie papa alfa call milano on one three four five two ,021_0490,del india charlie papa alfa call milano on one three four five two
alitalia four zero one turn right heading one eight zero ,051_0095,alitalia four zero one turn right heading one eight zero
airfrans three five six is identified climb to flight level three hundred ,111_0071,airfrans three five six is identified climb to flight level three hundred
swissair six five two zero set course to frankfurt ,031_0389,specia six five two zero second to frankfurt
hapag lloyd six five three climb flight level three three zero ,081_0953,harboleye six five three climb flight level three three zero
delta mike echo proceed direct to trasadingen ,041_0278,delta mike echo proceed direct to trasadingen
alitalia three six nine turn right to trasadingen ,041_0715,alitalia three six nine turn right to trasadingen
lufthansa four three nine zero milan one three four decimal five two bye bye ,111_0202,lufthansa four three nine zero milan one three four decimal five two bye bye
malaysian four contact rhein one two seven three seven tschuss ,031_0293,malaysian four contact rhein one two seven three seven trees
sabena eight zero one ah rhein identified ,071_0306,sabena eight zero one rhein identified
georgia air zero three seven rhein radar identified ,051_0041,georgia air zero three seven rhein radar identified
golf juliett india milan one three four five two bye bye ,111_0355,golf told india milan one three four five two bye bye
hapag lloyd three five five one continue descent flight level three three zero ,091_0525,hap a light three five five one con two descend flight level three three zero
alright thank you very much further climb radar one three three point four bye ,091_0810,a right thank you very much for to climb radar one three three point four bye
balkan four three one contact ah reims on one three four four bye ,101_0024,balkan four three one contact ah reims one three four four bye
aero lloyd five one seven turn left heading three six zero ,081_0035,irodod five one seven ten left heading three six zero
iberia three five three zero continue descent to flight level two nine zero ,111_0654,iberia three five three zero continue descend to flight level two nine zero
lufthansa four seven two three descend to flight level three zero zero ,091_0064,lufthansa four seven two three descend flight level three zero zero
speedbird one two nine descend flight level three three zero ,041_0246,speeba one two nine descend flight level three three zero
sabena eight zero six good afternoon squawk two seven four one ,101_0801,sabena eight zero six good afternoon squawk two seven four one
hapag lloyd six five three rhein radar identified climb flight level two seven zero ,051_0018,hapag lloyd six five three rhein radar identified climb flight level two seven zero
oscar hot disregard ,021_0493,asca hot desocad
airfrans one five five four good morning radar contact ,081_0758,airfrans one five five four good morning radar contact
lufthansa four five seven five your rate of climb ,091_0463,lufthansa four five seven five year rad of climb
sabena eight zero one climb flight level three four zero ,071_0328,sabena eight zero one climb flight level three four zero
speedway three three five two contact milano one three four decimal five two ,111_0734,speedway three three five two contact milano one three four decimal five two
affirm three seven four contact rhein one three two decimal four ,051_0777,a firm three seven four contact rhein one three two decimal four
malaysian four contact rhein radar one two seven decimal three seven ,021_0665,malaysian four contact rhein radar one two seven decimal three seven
alitalia three six nine contact zurich one three four decimal six ,051_0843,alitalia three six nine contact zurich one three four decimal six
sunwing five two one two turn right heading one nine zero ,041_0147,sending five two one two ten right heading one nine zero
hapag lloyd three five five one zurich one three three decimal four ,031_0495,hapag la three five five one zurich one three three decimal four
alitalia four zero one resume own navigation to saronno ,091_0215,alitalia four zero one resume mordification to saronno
alitalia one five seven turn right to trasadingen ,031_0538,alitalia one five seven turn right to trasadingen
lufthansa three five five six call zurich on one three four decimal six ,021_0501,lufthansa three five five six call zurich on one three four decimal six
india sierra alfa contact rhein one two seven three seven ,011_0047,india sierra alfa contact rhein one two seven three seven
tarom three seven two rhein one three two four tschuss ,021_0193,tarom three seven two rhein one three two four des
alitalia two four two turn right heading two nine zero ,071_0690,itaya two four two tenight heading two nine zero
sobelair two five five seven turn left heading one one zero separation ,011_0055,so la two five five seven turn left heading one one zero separation
adria one six four two is identified set course direct to morok ,092_0308,adria one six four two is identified set course direct to morok
tag alitalia three six nine identified ,021_0297,tag alitalia three six nine identified
alitalia two nine two good morning squawk two seven six one ,091_0135,ritalia two nine two good morning squawk two seven six one
tag sunwing five two one four identified ,031_0301,taxhanwing five two one four identified
co ,071_0788,good
lufthansa five two nine four climb to flight level three four zero ,071_0944,lufthansa five two nine four climb to flight level three four zero
airfrans one five zero nine turn right by ten degrees ,091_1013,airfrans one five zero nine turn right by ten degrees
sierra alfa foxtrot one one two contact rhein one two seven decimal three seven ,031_0111,sierra alfa foxtrot one one two contact rhein one two seven decimal three seven
sabena nine seven zero contact radar one two eight decimal one five au revoir ,072_0055,sabena nine seven zero contact radar one two eight decimal one five au revoir
yeah ,071_0309,t up
aerovic one zero six one contact milano one three four decimal five two ,012_0304,are back one zero six one contact milano one three four decimal five two
alitalia two nine one zurich radar good afternoon trasadingen saronno maintain flight level three three zero ,101_1000,alitalia two nine one zeric radar a good afternoon transadengan zero now maintain flight level three three zero
bonjour berlin five zero eight one cleared direct la tour du pin flight level three three zero ,081_0076,mogobeanin five zero eight one clear the direct la to du p flight level three three zero
ah alitalia four eight five good morning roger ,081_0354,alitalia four eight five good morning roger
speedbird five eight zero descend to flight level two one zero ,081_0029,speed rad five zero descend to flectdevel two one zero
lufthansa four seven two three milan one three four decimal five two good bye ,081_0244,lufthansa four seven two three milan one three four decimal five two good bye
sabena seven eight one six radar contact climb initially flight level three four zero trasadingen karlsruhe ,081_0929,sabena seven eight one six radar contact climb initially flight level three four zero transwede calsruer
hapag lloyd one three seven rhein radar identified ,011_0155,hapag lloyd one three seven rhein radar identified
airfrans six seven zero right heading one seven five ,111_0306,airfrans six seven zero right heading one seven five
and four two zero nine expect an initial descent in about two minutes from now ,031_0241,and four two zero nine expect an initial descend about two minutes from now
alitalia two nine two turn left by ten degrees ,061_0623,alitalia two nine two turn left by ten degrees
airfrans three five six good morning squawk seven five three six ,111_0067,airfrans three five six good morning squawk seven five three six
airfrans one five five four milan one three four five two good bye ,091_0660,airfrans one five five four milan one three four five two good bye
good morning alitalia one four nine radar contact ,091_0725,good morning alitalia one four nine radar contact
delta mike echo climb flight level two nine zero ,051_0299,delta mike echo climb flight level two nine zero
airlink one three milan one three four five two good bye ,101_0780,eirling one three milan one three four five two good bye
adria one six four four contact reims one three four four bye ,091_0273,adria one six four four contact reims one three four four bye
alitalia two six two contact reims one three two decimal two seven au revoir ,071_0893,alitalia two six two contact reims one three two decimal two seven au revoir
portugalia five four three contact geneva one three three one five good bye ,101_0758,portugalia five four three contact geneva one three three one five good bye
good afternoon israeli air force four four two maintain level three five zero ,101_0825,good afternoon israeli air force four four two maintain level three five zero
alitalia four one three can you accept flight level three one zero as cruising level today ,031_0150,alitalia four one three can u axcept flight level three one zero as cruising level today
transwede one zero seven continue present heading until advised ,081_0559,transwede one zero seven continue presonheading unsadvised
tag jet set one four two nine identified ,051_0477,tag read a one four two nine identified
lufthansa four two two three zurich radar good afternoon youre identified maintain flight level three three zero trasadingen zurich east fusse ,101_1044,ufthansa four two two three zereegreade air good afternoon are identified maintain flight level three three zero transadinan zuri east fusse
emirates eight one good morning maintain level three three zero trasadingen zurich east to fusse ,091_0540,emaradaid one good morning maintain al three three zero trasadingen zurokees to fuse
alitalia two nine two radar contact trasadingen karlsruhe climb flight level three two zero ,082_0079,alitalia two nine two radar contact air heading casrua climb flight level three two zero
aero lloyd five one seven continue present heading until advised ,091_0366,aero lloyd five one seven continue present heading until advised
delta mike echo good afternoon call you back ,101_0790,tele mike co good afternoon collieback
tarom three seven four is identified maintain the heading ,051_0740,tan three seven four identified maintain the heading
alitalia three zero one bonjour cleared passeiry torino flight level three three zero ,081_0008,alitalia three ze one o sure cleared passeiry torino flight level three three zero
alitalia three six nine turn right to trasadingen ,051_0823,alitalia three six nine turn right to trasadingen
alitalia one five zero is identified climb to flight level three hundred ,101_0693,alita day one five series identified climb to flight level three hundred
speedbird five six three identified cleared aosta st prex rolampont climb to flight level three six zero ,072_0023,speebard five six three identified cleadeostai said preronopon climb flight level three six zero
foxtrot sierra india descend flight level two five zero ,111_0467,fox to si india descend flight level two five zero
bonjour maintain flight level three three zero and ah proceed to passeiry ,071_0891,bonjour maintain flight level three three zero and proceed to passeiry
alitalia two six two contact reims on one three two decimal two seven good bye ,081_0147,alitalia two six two contact reims on one three two decimal two seven good bye
aerovic one zero six one turn immediately right heading ah two one five ,092_0092,elevac one zero six one turn immediately right heading ah two bond five
lufthansa five three zero five further right heading zero one five ,101_0661,lufthansa five three zero five four to right heading zero one five
swissair four eight eight turn right heading of ah zero eight zero ,082_0044,swissair four eight eight tran right heading of five zero eight zero
alitalia one one seven descend to flight level two five zero ,092_0303,alitalia one one seven descend flight level two five zero
alitalia two nine one turn now right to tango romeo alfa ,051_0795,alitalia two nine one ten now right to tango romeo alfa
