transcription,recording_id,model_transcription
roger ,091_0996,roge
saudia one eight three contact rhein control one three two decimal four bye ,081_0450,saudia one eight three condor rhein control one three two decimal four bye
sabena nine five nine bonjour identified passeiry tour du pin flight level three one zero ,071_0497,savinanan five nine bonjour identified passe re to du pin flight level three one zero
ah eva three two one bonjour identified cleared passeiry la tour du pin flight level two nine zero ,071_0937,eva three two one bonjour ridentifye clear passe re la tour du b flight level two nine zero
lufthansa five two one seven turn left to dinkelsbuhl delta kilo bravo ,041_0140,lufthansa five two one seven turn left to dinkelsbildata kilo bravo
okay make it heading ah two one two zero five ,092_0167,i can make it heading two one two zero five
lufthansa eight two two one maintain three three zero proceed trasadingen please ,091_0430,lufthansa eight two two one maintain three three zero please trasading please
merair six nine four four is identified proceed to tango romeo alfa climb to flight level two nine zero ,031_0665,a six nine four four identified proceed to tango romeo alfa climb to flight level two nine zero
alitalia one one seven zurich one three three four ,041_0461,alitalia one one seven zurich one three three four
lufthansa eight two six eight good morning maintain level two nine zero willisau st prex ,081_0200,lufthansa eight two six eight good morning maintain level two nine zero wilisaiuo st prex
swissair four eight eight climb to flight level three two zero ,092_0290,swesa four eight eight climb to flight level three two zero
malaysian four contact rhein one two seven decimal three seven ,061_0504,malaysian four contact rhein one two seven decimal three seven
emirates two is identified ,011_0177,emrads two is identified
ah london airtours one contact milano one three four decimal five two ,051_0317,elananeatus one contact milano one three four decimal five two
alitalia four eight five descend flight level two five zero ,091_0923,alitalia four eight five descend flight level two five zero
transwede one zero seven set course direct st prex ,082_0062,transwede one zero seven sechostaric and prex
aero lloyd five one seven ah turn left to trasadingen ,081_0808,aero lloyd five four seven ah turn left to trasading
ah jet set one four two nine good morning radar contact ,012_0062,a that set one four two nine good morning radar contact
lufthansa four five eight two climb flight level three hundred ,041_0397,lufthansa four five eight two climb flight level three hundred
delta echo bravo contact now zurich one three three decimal four good bye ,101_0648,delta echo bravo contact not zurich one three three decimal four good bye
airfrans six seven zero descend flight level two five zero rate at least two thousand five hundred ,101_0120,air four six seven zero descend flight level two five zero rad at least two thousand five hundred
lufthansa four three nine three contact now milan one three four five two ,081_0583,lufthansa four three nine three contact now milan one three four five two
air berlin five zero eight one turn right to st prex ,081_0226,airbolene five zero eight one turn right to st prex
condor one zero four contact radar on one three three decimal four and state your heading to radar bye bye ,091_0362,condor one zero four contact radar on one three three decimal four and state your heading to radar bye bye
turkair nine two five good morning squawk one zero zero five ,091_0914,tag a nine two five go morning squawk one zero zero five
swissair eight zero six contact rhein one two seven three seven good day ,071_0004,resia eight zero six contact rhein one two seven three seven good day
lufthansa four seven two three milan one three four five two good bye ,091_0566,lufthansa four seven two three milan one three four five two good bye
speedbird ah one two f four contact rhein one two seven three seven ,051_0127,speedbird ah one two four contact rhein one two seven three seven
hapag lloyd three five five one guten tag radar contact ,012_0097,hapag lloyd three five five one goodntack radar contact
sabena eight zero six turn right by one five degrees climb flight level three four zero ,101_0468,sabena zero six turn right by one five degrees climb flight level three four zero
tarom three seven four is in radar contact ,021_0617,tan three seven four in radar contact
tag lufthansa three five six six identified climb flight level two seven zero ,031_0173,tag lufthansa three five six six identified climb flight level two seven zero
lufthansa three five seven seven rhein one three two one three two four tschuss ,092_0243,lufthansa three five seven seven rhein one three two one three two four ches
oscar oscar papa hotel india rhein radar identified ,011_0107,oscar oscar papa hotel india rhein radar identified
sabena three zero two contact rhein one two seven three seven tschuss ,031_0265,sabena three zero two contact rhein one to seven three seven treeps
and hotel bravo india ah disregard ,021_0568,can hotel bravo einiett ah disregard
alitalia four eight five call zurich on one three three decimal four ,021_0464,alitalia four eight five call zurich on one three three decimal four
lufthansa three five five zero contact zurich one three four decimal six ,051_0284,lufthansa three five five zero contact zer one three four decimal six
portugalia five four three bonjour maintain flight level three one zero via st prex la tour du pin ,071_0721,to ge a five four three bonjour maintain flight level three one zero via said prex la tour du per
blue five seven two turn now right direct to canne ,081_0198,blue five seven two turn now right direct to canne
alitalia two nine two good morning squawk two seven six one ,111_0101,alitalia two nine two good morning squawk two seven six one
condor nine seven two turn left to sierra papa romeo ,111_0620,conna nine seven two then left to sierra papa romeo
sata nine six zero one bonjour cleared direct la tour du pin flight level three three zero ,071_0760,tatannaine six sir one bonjour cleared the tag la tour du pin flect level three three zero
alitalia one one nine own navigation canne ,081_0689,alitalia one one nine own navigation canne
midland seven two zero turn right by one five degrees ,011_0128,midland seven two zero turn right by one five degrees
aero lloyd three eight one roger descend to flight level two five zero ,091_0147,rad three eight one roger descend to flight level two five zero
lufthansa three six zero four is identified climb to flight level three hundred ,041_0565,lufthansa three six zero four is identified climb to flight level three hundred
lufthansa four five seven five good morning radar contact continue climb flight level three one zero ,081_0655,lufthansa four five seven five good morning radar contact continue climb flight level three one zero
exact ,111_0627,exact
alitalia four one six contact now rhein control on one three two four ,101_0439,alitalia four one six contact now rhein control on one three two four
lufthansa four four one six right turn heading one eight zero ,071_0279,lufthansa four four one six right turn heading modeade zero
bama one five zurich radar good morning identified maintain flight level three three zero trasadingen stand by ,091_0997,bama one five zuri radar good morning identified maintain flight level three three zero transadengenst i
tag delta mike echo identified climb flight level two seven zero ,021_0251,tag delta may echo identified climb flight level two seven zero
sierra alfa foxtrot one one two non r v s m you are identified ,021_0078,yera alfa foxtrot one one two non r v s m u are identified
ah roger turn ah left heading two one five to keep you within the airway ,092_0161,roger tonna left heading two one five to keep you within the airway
tag aero lloyd five six two identified climb flight level two seven zero ,021_0312,tag aerolod five six two identified climb flight level two seven zero
alitalia one one nine call zurich on one three four decimal six ,012_0105,alitalia one one nine call zurich on one three four decimal six
sobelair two five two one contact rhein one three two decimal four tschuss ,031_0169,so la two five two one contact rhein one three two decimal fortress
lufthansa four two zero nine continue descent ah disregard ill call you back for further descent in a minute ,041_0620,lufthansa four two zero nine continue descent ah disregard i call you back for further descent in a minute
netherlands air force four one four rhein radar identified confirm non masp ,051_0068,nezalens air force four one four rhein radar identified confirm non masp
aero lloyd five nine zero continue climb to level three zero zero ,061_0268,aero lloyd five nine zero continue climb to level three zero zero
okay switch over to reims please ,101_0891,au case with over two reims please
okay ah descend to flight level three four zero and turn right one zero degrees ,081_0883,okay ah descend flight level three four zero and turn right one zero degrees
swissair four eight eight good morning radar contact ill call you back with further climb ,091_0364,swissair four eight e-good morning radar contact ni call you back with for a climb
britannia three zero six alfa rhein radar one three two decimal four ,041_0141,britannia three zero six alfa rhein radar one three two decimal four
nato ten contact rhein radar one two seven decimal three seven ,051_0793,nato ten contact rhein radar one two seven decimal three seven
alitalia two one six identified cleared st prex arbos epinal climb to flight level three zero zero ,071_0668,italia two one six identified clear do si prex arbocepinal climb flectibal three zero zero
good morning german air force four nine zero one radar contact maintain flight level three four zero trasadingen st prex ,081_0963,good morning german air force four nine zero one radar contact maintain flight level three four zero tra heading said prex
speedbird seven seven whiskey whiskey contact reims one three four decimal four good day ,092_0407,speeberd seven seven whiskey whiskey contact reims one three four decimal four good day
air malta four five zero contact rhein one three two decimal four bye bye ,092_0066,air malta four five zero contact rhein one three two decimal four bye bye
saudia one zero six good afternoon identified ,041_0029,sadiawanesaro six good afternoon identified
alitalia one five zero good afternoon identified ,051_0267,alitalia one five zero galafcanon identified
jat two seven three is identified ,051_0647,jat two seven three is identified
s ,021_0366,p s
aero lloyd five six zero good morning radar contact maintain flight level three three zero trasadingen st prex ,091_0290,aero lloyd five six zero good morning radar contact maintain flight level three three zero tra heading said prex
lufthansa four three nine three good morning radar contact proceed via trasadingen zurich east fusse ,082_0003,lufthansa four three nine three good morning radar contact proceed my tra heading zurigesfusex
alitalia one five eight is cleared trasadingen direct to luxeuil ,101_0681,alitalia one five eight is clear trasading direct to dexoy
delta papa alfa good morning radar contact ,021_0427,delta papa alfa good morning radar contact
lufthansa four four one six climb to flight level three one zero ,111_0175,lufthansa four four one six climb to flight level three one zero
tag sabena eight three zero identified ,041_0213,tag sabena three zero identified
delta mike echo climb now flight level three five zero ,051_0327,delta mike echo climb now flight level three five zero
foxtrot sierra india rhein radar identified call you back for higher ,051_0009,fox for sierra india rhein radar identified qubackfire
aero lloyd five six two good morning ,111_0368,aero lloyd five six two good morning
lauda one zero nine from zurich ,101_0360,lauda one zero nine from zurig
rhein contact geneva one two eight decimal one five au revoir ,071_0836,and contact geneva one two eight decimal one five au revoir
ah delta echo charlie im not sure whether you got it you proceed to dinkelsbuhl ,011_0349,a delta echo charlie im not sure whether ugaded u proceed direct to dinkelsbu
foxtrot sierra india climb flight level three three zero set course trasadingen ,021_0005,foxtrot sierra india climb flight level three three zero set constrasadingen
delta mike echo turn left one zero degrees ,101_0796,delta mike co turn left one zero degrees
golf juliett india turn right to trasadingen tango romeo alfa ,041_0052,golf juliead india turn right to trasadingen tango romeo alfa
turkish five one five contact rhein one two seven decimal three seven ,071_0289,turkish five one five contact rhein one two seven decimal three seven
tag alitalia one one seven identified what is your rate of climb ,061_0043,tag alitalia one one seven identified vodesia rad of climb
alitalia three hundred contact paris on one three three decimal eight two good bye ,081_0062,alitalia three hundred contact paris on one three three decimal at two good bye
aero lloyd five one seven contact rhein control one two zero decimal nine two bye ,091_0898,aero do five one seven con to rhein control one two zero decimal nine two bye
midland seven two zero set course to costa ,011_0136,midland seven two zero said cross to costa
lufthansa four two zero nine rhein ,051_0294,lufthansa four two zero nine rhein
aero lloyd five six two proceed to hotel oscar charlie afterwards st prex flight planned route ,041_0733,aero lloyd five six two proceed to hotel oscar charlie afterwards one prex flight plantrude
k l m three four six contact rhein one two seven three seven tschuss ,061_0413,calem three four six contact rhein one two seven three seven trees
hapag lloyd three five five one zurich frequency one three three four tschu ,051_0567,habaclod three five five one zurich frequency one three three four three
lufthansa four three nine three descend flight level three one zero ,091_0374,lufthansa four three nine three descend flight level three one zero
aviva nine zero eight one descend flight level three three zero rate two thousand ,111_0508,a r v a nine zru eight one descend flight level three three zero rate two thousand
roger ill call you back for further climb ,071_0632,al tag al back for for do climb
lufthansa four seven zero three good morning radar contact maintain flight level three four zero proceed zurich east fusse ,101_0280,lufthansa four seven zero three good morning radar contact maintain flight level three four zero force zureggesfu set
swissair nine three five nine contact rhein one three two four tschuss ,021_0305,swissair nine three five nine contact rhein one three two fortres
oscar hotel india rhein radar identified ,031_0108,oscar hotel india rhein radar identified
viva nine zero eight one milan one three four five two good bye ,091_0654,viva nine zero eight one milan one three four five two good bye
l t u seven seven five six climb to flight level three five zero ,072_0187,l t u seven seven five six climb to flight devel three five zero
constellation two two five one contact rhein one three two decimal four ,061_0512,constellation two two five one contact rhein one three two decimal four
bama one five turn now right direct to zulu uniform echo ,051_0178,bama one five two now right direct to zulu uniformeco
roger k l m three four six squawk two seven six six ,111_0631,rogard call in three for six squawk two seven six six
alitalia four one three climb to level two five zero direct trasadingen ,041_0542,alitalia four one three climb to level two five zero direct trasading
sabena four eight one turn to delta kilo bravo ,041_0404,sabena four eight one turn to delta kilo bravo
lufthansa four seven zero three zurich radar good afternoon maintain flight level three five zero ,101_0868,ofthansa four seven zero three zerig radar good afternoon maintain flight level three five zero
air malta zero zero four call rhein one two seven three seven ,061_0279,air malta zero zero four call rhein one two seven three seven
lufthansa eight two two one ah milan one three four five two good bye ,081_0383,lufthansa eight two two one milan one three four five two good bye
ah station calling say again the callsign please ,092_0117,a station calling second call one please
speedbird two five seven seven identified cleared aosta st prex rolampont and climb to flight level three four zero ,071_0710,speedbird two five seven seven identified cleadausta saprerolopo and climb to flextible three four zero
tunair four eight zero two contact rhein one two seven decimal three seven ,041_0761,two no four eight zero two contact rhein one two seven decimal three seven
jetaviation seven zero one descend to flight lev ah disregard maintain level three four zero ,092_0379,jetaviation seven zero one descend to flight lev artistregard maintain level three four zero
hallo alitalia four one three identified maintain two five zero upon reaching ,051_0617,hallo alitalia four one three identified maintain two five zero pon reaching
german air force five eight five set course to frankfurt ,031_0052,go an air force five eight five set cross to frankfurt
alright one three three one five please ,101_0459,a right one three three one five please
india lima oscar oscar kilo zurich radar good afternoon youre identified route trasadingen saronno maintain flight level two nine zero call you back for further climb ,101_0932,india le oscar oscar kilo zerygreadear get afternoon near identified rutetransadingen sarona maintain flight level two nine zero call back for through climb
lufthansa eight two six eight call zurich on one three four decimal six ,012_0029,lufthansa eight two six eight call zurich on one three four decimal six
sabena nine three seven two calling ,081_0030,sabena nine three seven two calling
air portugal five one one three climb now correction air portugal four one one three climb to flight level three three zero ,081_0377,the prortogal five one one three climb out correction air prortogal four one one three climb to flight level three three zero
swissair nine three five nine continue descent to flight level three one zero ,021_0663,swissair nine three five nine continue descend to flight level three one zero
roger what is your position ,101_0199,but do you have bodeshar position
ascot nine three one nine set course direct to rolampont ,071_0424,ascot nine three one nine sadcoas direct to holopo
delta echo bravo climb initially to flight level three two zero ,091_0966,delta echo bravo climb initially to flight level three two zero
foxtrot sierra india milan one three four five two good bye ,081_0789,fox to sierra india milan one three four five two good bye
con ah so pick up ah heading of ah one six five ,041_0490,con so pick up a heading of one six five
k l m three four six is identified report your heading please ,031_0568,kaliam three four six is identified report yeaheading please
sabena seven eight one six turn r left to nattenheim ,061_0581,sabena seven eight one six turn left to nightenheim
alitalia four eight five contact zurich one three three decimal four ,031_0477,alitalia four eight five contact zurich one three three decimal four
lufthansa four six six five milan one three four decimal five two bye bye ,101_1032,lufthansa four six six five milan one three four decimal five two bye bye
hapag lloyd six five three climb to level three one zero ,041_0419,abag lloyd six five three climb to level three one zero
netherlands four one four non r v s m radar contact ,041_0462,netherlands four one four non r v s m radar contact
k l m three four six climb to flight level three two zero ,071_0028,kelum three four six climb flight level three two zero
stand by air malta zero zero four turn right heading zero three zero ,111_0012,stand by air malta zero zero four teen right heading zero three zero
l t u seven seven five six good afternoon roger ,091_0652,l t u seven seven five six good afternoon roger
emirates eight one good morning maintain level three three zero trasadingen zurich east to fusse ,081_0196,emuradsaid one good morning maintain level three three zero trasadingen zuraqees to fusse
merair six nine four four direct to trasadingen ,071_0102,may air six nine four four direct to trasading
sunwing five two one four contact zurich one three three decimal four ,021_0699,sunwing five two one four contact zero one three three decimal four
gulf air zero three two turn further left heading zero eight zero ,091_0631,golf air zero three two turn for left heading zero eight zero
ah good morning netherlands air force three five in radar contact ,012_0117,good morning netherlands air force three five in radar contact
hapag lloyd one one two contact rhein radar one two seven decimal three seven ,041_0034,aragloid one one two condact rhein radar one two seven decimal three seven
air malta one hundred good morning squawk five seven one seven ,111_0122,air malta one hundred good mornings squawk five seven one seven
air malta four five zero proceed to zulu uniform echo ,111_0754,air malta four five zero proceed to zulo uniform eco
alitalia two three four contact reims one three two decimal two seven au revoir ,072_0095,alitalia two three four contact reims one three two decimal two seven au revoir
lufthansa four two zero seven good afternoon in radar contact ,071_0021,lufthansa four two zero seven good afternoon in radar contact
and swissair six five five two contact milan one three four five two good bye ,091_0608,and swissair six five five two contact milan one three four five two good bye
meridiana six nine five two proceed now own navigation to trasadingen tango romeo alfa ,012_0289,raiana six nine five two proceed now own navigation to trasadingen tango romeo alfa
ah delta mike echo disregard maintain heading ,051_0812,ah delta mike echo disregard maintain heading
air malta one hundred reims one three four four good bye ,092_0383,air malta one hundred reims one three four four good bye
portugal four one one three contact zurich one three four decimal six au revoir ,072_0140,portagal four one one three contact zuric one three four decimal six au revoir
bama one five as well milan one three four five two bye bye ,091_1049,bama one five as well milan one three four five two bye bye
four four two correct rate of descent two thousand feet or more please ,092_0120,four four two correct rate of descend two thousand feet or more please
merair six nine five two climb flight level two five zero ,041_0284,may six nine five two climb flight level two five zero
roger cleared passeiry la tour du pin flight level three zero zero ,071_0798,roger clear the passeiry lateordepai flight level three zero zero
swissair eight zero six report your rate of climb ,011_0220,swi a eight zero six report your rad of climb
k l m three hundred kilo for shortcut turn left by ten degrees ,031_0040,calim three hundred kilo four short cat turn left by ten degrees
sabena eight three two turn left one five degrees ,021_0424,sabena three two turn left one five degrees
k l m three four six climb flight level three two zero ,041_0234,call im three four six climb flight level three two zero
swissair eight zero six climb now flight level three five zero one thousand five hundred or more ,041_0209,swiss eight zero six climb now flight level three five zero one thousand five hundred or more
lufthansa five three one eight contact milan one three four five two bye ,111_0429,lufthansa fi three one can a milan one three four five two bye
thank you ,101_0453,thank u
constellation two two five one rhein radar identified ,031_0020,constellation two two five one rhein radar identified
lufthansa three five six six continue climb to flight level two nine zero ,051_0653,lufthansa three five six six continue climb to flight level two nine zero
lufthansa three five five zero descend to flight level two five zero ,092_0068,lufthansa three five five zero descend to flight level two five zero
golf juliett india descend to flight level two nine zero ,101_0798,golf juliett india descend flight level two nine zero
austrian four one six whiskey zurich radar good morning identified trasadingen zurich east fusse maintain flight level three four zero ,111_0365,austian four one six whiskey zurygreadear good morning identified trasadingen zuregestfrug emintain flight level three four zero
airfrans one five five four turn left for heading of zero nine zero ,081_0525,airfrans one five five four turn left for heading of zero nine zero
swissair eight zero six contact rhein radar one two seven decimal three seven ,031_0574,swesaide zero six contact rhein radar one two seven decimal three seven
tag hotel bravo india tango romeo identified ill call you back shortly for higher ,031_0215,tag hotel bravo india tango romeo identified at call back shortly for higher
alitalia four eight seven call zurich on one three four decimal six buongiorno ,021_0487,alitalia four eight seven call zurich on one three four decimal six sbongeano
alitalia four eight five descend to flight level two nine zero ,081_0886,alitalia four eight five descend to flight level two nine zero
alitalia two three four bonjour squawk five seven seven five ,071_0380,italia two three four bonsouscuuk five seven seven five
tarom three seven four report your heading ,041_0635,tarom three seven four report your heading
bye bye ,031_0547,for air
india fox golf turn right to zurich east ,111_0163,india fox calfturn right two zurich east
airfrans three two six one own navigation to st prex ,111_0038,airfrans three two six one own navigation to st prex
thats correct ,091_0341,thats correct
luftha sorry speedway three three five two descend to flight level two nine zero ,091_1061,sorry speedway three three five two descend to flight level two nine zero
