transcription,recording_id,model_transcription
lufthansa eight two two one ah contact milan one three four five two good bye ,092_0362,lufthansa eight two two one contact milan one three four five two good bye
fox oscar kilo sierra india climb to flight level two seven zero ,051_0427,fox oscar kilo sierra india climb to flight level two seven zero
britannia triple two alfa rhein radar identified ,071_0260,britannia triple two alfa rhein radar identified
airfrans six seven zero continue descent to flight level two five zero ,092_0026,air fo six seven zero continue descend to flight level two five zero
germania five four zero own navigation to st prex ,081_0250,germania five four zero own navigation to s prex
transwede one zero seven good afternoon radar contact maintain flight level three three zero trasadingen st prex ,111_0482,transwede one zero seven good afternoon radar contact maintain flight level three three zero trasadingen prex
k l m three one seven descend to flight level two nine zero ,051_0770,caliam three one seven descend to flight level two nine zero
lufthansa four five eight two proceed to trasadingen ,021_0698,lufthansa four five eight two proceed to trasadingen
u s air one four good afternoon radar contact heading of zero nine zero descend flight level three four zero ,111_0509,u s a one four good afternoon radar contact heading of zero nine zero descend flight level three four zero
lufthansa eight two six eight climb flight level three five zero ,091_0309,lufthansa eight two six see climb flight level three five zero
hapag lloyd one seven one cleared direct bilsa ,072_0128,naboclod one seven one three direct bilsa
emirates zero two four contact milan one three four decimal five two bye bye ,101_0946,emeradzeral two four contact milan one three four decimal five two bye bye
aero lloyd five six zero geneva one three three one five own navigation to st prex ,092_0204,aero lloyd five six zero geneva one three three one five own navigation to st prex
and report heading to zurich one three three four good bye ,111_0021,and report heading to zurich one three three four good bye
lufthansa four two zero seven contact now rhein radar one three two decimal four good bye ,051_0704,lufthansa four two zero seven contact now rhein radar one three two decimal four good bye
sunwing five two one two in radar contact ,021_0657,sunwing five two one two in radar contact
k l m three four six turn left to november tan ah k l m three four six turn left to nattenheim november tango mike ,012_0220,go three four six teen left two november ting ah kilhem three four six teen lefton nutenheim november tango mike
olympic one four four proceed direct to kempten ,071_0216,olympic one four four proceed direct to kempten
airfrans three five six good morning squawk seven three five correction seven five three six ,092_0234,airfrans three five six good morning squawk seven three five correction seven five three six
saudia three four one good afternoon radar contact ,091_0626,saudia three four one good afternoon radar contact
air malta zero zero four contact rhein one two zero nine two good bye ,111_0022,air malta zero zero four contact rhein one two zero nine two good bye
aerovic one zero six one report your heading ,061_0486,aerovic one zero six one report a heading
aero lloyd five three three bonjour maintain flight level three four zero kines st prex willisau ,071_0630,rad five three three monsule manefectival three four zero kines air prevedeseairo
tag transwede one one one zero one identified ,051_0410,tag transwede one one one zero one identified
bonjour centennial one five seven identified st prex willisau flight level three two zero ,071_0568,ogerosandanial one five seven identified so prewilisair flight level three two zero
lufthansa three five five zero proceed direct to tran trasadingen climb flight level two nine zero ,061_0419,ufthansal three five five zero proceed direct to tangtrasadingen climb flight level two nine zero
india fox golf good morning squawk two seven four four ,111_0139,india fox golf good morning squawk two seven four four
netherlands air force four one four call zurich on one three three decimal four ,021_0465,netherlan air force four one four call zurich on one three three decimal four
ah air berlin five two five five guten tag identified ,031_0166,ebelin five two five five con tag identified
lufthansa eight two six eight own navigation to olben st prex ,081_0217,lufthansa eight two six eight own navigation to aulbonesain prex
alitalia two nine two good morning squawk two seven six one ,081_0311,alitalia two nine two good morning squawk two seven six one
transwede one zero seven continue climb flight level three three zero ,061_0066,transwede one zero seven continue climb flight level three three zero
sorry station calling ,092_0175,sorry station calling
lufthansa five nine three one good afternoon radar contact maintain flight level three four zero continue present heading until advised ,101_0124,lufthansa five nine three one good afternoon radar contact maintain flight level three four zero continue present heading until advised
roger continue present heading ,071_0806,marcha continue present heading
u s air one four fly heading now again zero nine zero ,091_0875,u s a one four fly heading now again zero nine zero
tag golf bravo victor juliett india identified ,041_0235,tag golf bravo victor juliett india identified
roger one zero six one resume own navigation to trasadingen ,071_0094,racha one zero six one resume own navigation to trasading
airlink one three zurich radar good morning identified route trasadingen zurich east fusse maintain flight level three zero zero ,092_0009,elinguon three zero quite air good morning identified through transading zuri get emitain flight level three zero zero
netherlands air force one four rhein radar identified ,021_0051,netherlands air force one four rhein radar identified
air berlin five zero eight one contact radar one two eight one five good bye ,081_0107,air berlin five zero eight one contact radar one three t one five good bye
blue five seven two descend flight level two five zero ,111_0420,lu fine seven two descend flight level two five zero
tag delta india mike mike echo identified climb to flight level two five zero ,031_0243,tag delta enia mike mike echo identified climb to flight level two five zero
airfrans one five five four descend flight level two seven zero ,081_0539,airfrans one five five four descend flight level two seven zero
lufthansa three six zero four zurich one three four decimal six ,021_0214,lufthansa three six zero four zurich one three four decimal six
jetcom one three three expect higher in about ah three minutes ,092_0209,jetcom one three three expect air in about three minutes
cotam one one four one descend flight level three one zero ,091_0352,cotam one one four one descend flight level three one zero
shamrock four eight six four contact rhein control on one three two decimal four bye bye ,111_0389,shamrock four eight six four cont rhein control on one three two decimal four bye bye
cross air eight five eight contact rhein one two seven decimal three seven ,031_0663,cross eight five eight contact rhein one two seven decimal three seven
viva nine zero eight one turn right to willisau ,081_0064,viva nine zero eight one turn height to vilisau
oh sorry jet set four four two level is two nine zero ,091_0838,au sorry just a four four two level two nine zero
delta seven six descend flight level three one zero ,082_0154,delta seven six descend flight level three one zero
india yankee juliett milan one three four five two bye ,081_0668,india yankee judett milan one three four five two bye
lufthansa eight two six eight set course to trasa ,031_0005,lufthansa eight two six eight at call to trasa
station calling say again ,011_0045,station calling segon
turn left one five degrees ,021_0425,turn left one five degrees
alitalia one three five contact zurich one three four decimal six ,041_0183,alitalia one three five contact zurich one three four decimal six
transwede three five seven one direct luxeuil ,091_0318,transwede three five seven one direct lu say
lufthansa three six zero four contact zurich one three four decimal six tschuss ,031_0209,lufthansa three six zero four contact zurich one three four decimal six thees
roger contact milan one three four five two good bye ,081_0327,roger contact milan one three four five two good bye
alitalia two six two climb to flight level three two zero ,071_0866,alitalia two six two climb to flight level three two zero
five three zero five and fly heading zero one zero ,091_0976,five three zero five and fly heading zero one zero
constellation two two five one contact rhein one three two decimal four ,051_0043,constellation two two five one contact rhein one three two decimal four
ah negative alitalia one five zero alitalia two nine one right turn one five degrees to report new heading ,012_0258,ah negative alitalia one five zero alitalia two nine one right turn one five degrees to report new heading
lufthansa triple five zero is identified fly heading two five zero ,111_0029,dufthansa triple five zero is identified fly heading two five zero
transavia three eight one turn left heading one seven zero ,081_0184,transavia three eight one turn left heading one seven zero
egypt air eight eight four is identified ,051_0779,egypt a eight eight four identified
sabena nine three six nine zurich on one three four six ,041_0547,sabena nine three six nine zurich on one three four six
aero lloyd five one seven contact now zurich on one three four decimal six good bye ,071_0436,aero lloyd five one seven contact now zuri on one three four decimal six good bye
transwede three five seven one reims one three four decimal four good bye ,091_0059,tran be three five seven one ra one three four decimal four bye
alitalia two nine one proceed now own navigation to kilo romeo hotel ,041_0117,alitalia two nine one proceed now own navigation to kilo romia hotel
roger do so ,051_0361,roger do so
iberia four four seven six contact zurich on one two five decimal eight five good bye ,071_0686,ibaia four four seven six contact zuri on one two five decimal eight five good bye
p s a five zero two hotel guten tag identified ,061_0566,p s a five zero two hotel when tag identified
k l m two six four turn left heading three five five ,061_0084,call im two six four turn left heading three five five
lufthansa four two zero nine contact rhein radar one three two decimal four ,011_0268,lufthansa four two zero nine contact rhein radar one three two decimal four
oh im very sorry turn right by ten degrees until advised ,111_0251,oh im very sorry turn right by ten degrees until advised
u s air one four good morning descend to flight level three three zero ,081_0298,u s a one four good morning descend to flight level three three zero
swissair six five two zero proceed direct trasadingen ,081_0915,swissair six five two zero proceed direct trasading
lufthansa three five five six contact zurich one three four decimal six good bye ,031_0139,lufthansa three five five six contact zurich one three four decimal six go bye
contact milan one three four five two good bye ,091_0038,contact milan one three four five two good bye
hallo lufthansa five two nine four radar contact climb flight level three three zero ,111_0387,hallo lufthansa fanctionina four radar can sec climb flight level three three zero
air inter three two zero papa hotel set course direct morok ,111_0050,air anti three three zero papa hotel at case direct morok
lufthansa four five seven five rhein control one three two decimal four bye bye ,091_0936,lufthansa four five seven five rhein control one three two decimal four bye bye
lufthansa four six five two right heading two two zero ,091_0170,lufthansa four six five two right heading two two zero
tag transwede one zero seven identified ,051_0453,tag transwede one zero seven identified
tag alitalia four zero one identified ,051_0503,tag alitalia four zero one identified
alitalia one five zero identified ,051_0731,alitalia one five zero identified
sabena eight two six alfa direct nattenheim ,051_0625,sabena eight two six alfa direct nattenheim
lufthansa four two zero nine turn left direct to dinkelsbuhl delta kilo bravo ,011_0258,lufthansa four two zero nine turn left dike to dinkelspirel delta kilo bravo
tarom seven five three three contact reims one three four four good bye ,101_0641,tarom seven five three three contact reims one three four four good bye
air berlin five two six one geneva one three three one five good bye ,101_0789,erbolin five two six one geneva one three three one five good bye
lufthansa four five seven five ah rhein one three two decimal four good bye ,092_0363,lufthansa four five seven five ah rhein one three two decimal four good bye
lufthansa four five eight two is identified climb flight level two nine zero ,041_0175,lufthansa four five eight two identified climb flight level two nine zero
i f o two two bravo good afternoon squawk seven five three five ,101_0756,if for two two bravo good afternoon squawk seven five three five
aero lloyd five one seven set course direct to karlsruhe ,092_0289,aero lloyd five one seven set course direct to case
sabena eight zero one rhein radar identified ,021_0132,pin eight zero one rhein readar identified
lufthansa triple three zero good afternoon climb to flight level two nine zero ,071_0142,lufthansa triple tree zero good afternoon climb to flight level two nine zero
roger your rate at least two thousand please ,091_0498,roge a rate at least two thousand please
alitalia four zero one now youre recleared flight level three three zero the rate of climb at least two thousand ,082_0103,alitalia four zero one now u re clear flight level three three zero the radar climb a least two thousand
sabena eight zero one rhein radar identified ,051_0141,tabina eight zero one rhein radar identified
viva five eight five contact rhein one two seven decimal three seven ,011_0085,viva five eight five contact rhein one two seven decimal three seven
lufthansa eight two six eight climb to flight level three three zero on heading one eight zero ,041_0418,lufthansa eight two six eight climb to flight level three three zero on heading one eight zero
onur air nine eight nine guten tag and georgia air zero three seven both identified ,051_0456,ono air nine nine guten tag and georgia air zero three seven both identified
jet set eight one seven contact rhein one two seven decimal three seven ,021_0042,jat said ah one seven contact rhein one two seven decimal three seven
tunair four eight zero two contact rhein one two zero decimal nine two bye bye ,092_0070,t one four eight zero two contact rhein one two zero decimal nine two bye bye
affirm britannia three two seven alfa contact rhein one three two decimal four ,012_0204,a fi britannia three two seven al for contact rhein one three two decimal four
lufthansa three six zero four contact zurich one three four decimal six ,051_0239,lufthansa three six zero four contact zer one three four decimal six
airfrans six seven three four f climb to flight level three five zero ,081_0332,a from six seven three four climb to flight level three five zero
affirm ,051_0220,is a
sobelair two five five seven rhein one through one three two decimal four tschuss ,061_0069,sobelair two five five seven rhein one two one three two decimal fortress
aero lloyd five nine zero contact milan one three four five two bye ,091_0504,zero l i five nine zero contact milan one three four five two bye
hapag lloyd one nine five bonjour identified cleared valda passeiry bilsa flight level three four zero ,072_0019,appoloyd one nine five bonjour radentified clead valda passeiry bilsa flight able three four zero
alitalia one four nine zurich one three four six ,041_0552,alitalia one four nine zurich one three four six
sabena eight two six alfa is in radar contact ,061_0321,sabena eight two six alfa s in radar contact
k l m two six four turn left to nattenheim ,012_0085,gelam two six four turn left to nuttenheim
midland seven two zero call rhein one two seven three seven good day ,061_0341,midland seven two zero call rhein one two seven three seven are
yeah sabena eight zero one i observe you at flight level two nine zero in the viscinity of romeo mike sierra on a heading you are two nine zero maintaining confirm your level ,071_0332,a sabena eight zero one i observe fu at flight level two nine zero in the vecinity of romeo mike yera on a heading u are two nine zero maintaining confirm your level
t w a eight hundred contact milano one two five eight five good bye ,071_0634,t w a eight hundred contact milano one two five eight five good bye
aero lloyd five six zero good morning radar contact ,092_0149,aero lloyd five six zero good morning radar contact
air berlin five two six one good morning radar contact maintain flight level three three zero trasadingen st prex ,101_0347,aebolen five two six one good morning radar contact maintain flight level three three zero trasading prex
delta seven six good morning descend flight level three three zero ,081_0702,delta seven six good morning ah descend flight of three three zero
airfrans three two six one good afternoon squawk two seven two four ,111_0401,airfrans three two six one good afternoon squawk two seven two four
transwede one zero seven contact ah zurich one three four decimal six ,071_0236,transwede one zero seven contact deaat zurich one three four decimal six
foxtrot sierra india climb now flight level two nine zero tschu ,061_0024,fox four sierra india climb now flight level two nine zero three
swissair nine three five two contact rhein on one two seven three seven ,021_0004,swesia nine three five two contact rhein on one two seven three seven
delta india bravo echo charlie contact rhein one three two decimal four tschuss ,031_0346,delta india bravo echo charlie contact rhein one three two decimal fortres
alitalia four one three rhein radar identified climb to flight level two seven zero ,031_0535,alitalia four one three rhein radar identified climb to flight level two seven zero
air malta zero zero four descend flight level three four zero ,051_0070,air malta zero zero four descend flight level three four zero
hapag lloyd six five three good morning ah continue climb to flight level two nine zero ,021_0371,hapag lloyd six five three good morning ah continue climb to flight level two nine zero
lufthansa three five five six good afternoon maintain level two nine zero trasadingen canne ,081_0899,lufthansa three five five six good afternoon maintain level two nine zero trasadingen canne
lufthansa eight two two one set course direct fusse ,082_0118,lufthansa eight two two one sacostarifuse
lufthansa four two zero nine is identified ,051_0703,lufthansa four two zero nine is identified
lufthansa four four one six direct saronno ,111_0572,lufthansa four four one six direct torono
balkan four three one is identified maintain three four zero trasadingen morok ,101_0638,balkan four three one is identified maintain three four zero trasadingen morok
alitalia three six nine turn right to trasadingen ,041_0172,alitalia three six nine turn right to transeningen
alitalia four eight seven good morning ah radar contact maintain flight level three zero zero trasadingen canne ,082_0133,alitalia four eight seven good morning now radar contact maintain flight level three zero zero trasad in canne
air algerie two zero seven three good afternoon ill call you back for climb route trasadingen st prex ,101_0840,air already two zero seven three good afternoon i calliback for climb route trusteading an so prex
speedbird one two nine contact rhein one three two four tschuss ,031_0221,spar one two nine contact rhein one three two fortres
french line nine one six five ah milan one three four five two good bye ,101_0705,french line nine one six five for milan one three four five two good bye
aero lloyd five six two turn right to trasadingen ,051_0826,zero la five six two turn right to trasadingen
tag aero lloyd five one seven identified ,061_0128,tag aerolod five one seven identified
speedbird one two four contact rhein on one two seven three seven good day ,012_0123,speedbird one two four contact rhein on one two seven three sevengooday
israeli four four two contact milan one three four five two bye ,101_0244,israeli four four two kines of milan one three four five two bye
aero lloyd five six zero report your heading ,092_0160,aero lloyd five six zero report heading
three six zero four give me a good rate of climb until passing three two zero please ,111_0263,three six zero four ge a good rate of climanted passing three two zero please
aero lloyd five six zero turn right to st prex ,091_0033,aero lloyd five six zero turn right to st prex
lauda six eight six nine descend to flight level two nine zero ,091_0249,lauda six eight six nine descend to flight level two nine zero
alitalia one four nine direct trasadingen ,051_0607,alitalia one four nine or direct trasadingen
cotam one one four one good morning roger ,111_0073,cotam one one four one good morning roger
sabena four eight one contact rhein one three two decimal four ,021_0002,sabena four eigh one contact rhein one three two decimal four
hapag lloyd one one two contact rhein radar one two seven decimal three seven ,011_0245,habaglid one one two conduct rhein radar one two seven decimal three seven
turkish nine two five your heading ,091_0925,turgis nine two five your heading
alitalia three two four contact reims one three four four ,092_0109,alitalia three two four contact reims one three four four
aerovic one zero six one can you increase to decimal seven six or more ,041_0093,are back one zero six milecenude increase to decimal seven six or more
alitalia four eight five good morning descend to flight level two five zero ,111_0187,alitaria four eight five good morning descend to flight level two five zero
tag lufthansa four two zero nine identified ,041_0261,tag lufthansa four two zero nine identified
sunwing five two one four contact zurich one three three decimal four ,031_0747,saiming five two one four contact zer one three three decimal four
lufthansa four five seven five ah set course direct to trasadingen nelli ,081_0366,lufthansa four five seven five ah secorstadic two trasadingen neli
make it one three two four ,101_0821,make it one three two four
lufthansa five two nine four good morning radar contact continue climb flight level three three zero ,081_0444,lufthansa five two nine for good morning radar contact cont u climb flight level three three zero
speedbird two eight three nine is identified route hochwald to morok for further climb zurich one three three four good bye ,101_0815,speeber two eight three nine residentified route hochwald to morok for third climb zurich one three three four bye
georgia zero three seven good morning radar contact ,021_0389,on georgia zero three seven good morning radar contact
turkish nine two five own navigation morok ,091_0935,turgees nine two five own navigation morok
alitalia four eight five descend to flight level two five zero ,081_0896,alitalia four eight five descend to flight level two five zero
alitalia two nin no disregard ,061_0492,alitalia two nine no disregard
saudia one zero six contact rhein radar one three two decimal four ,051_0259,saudia one zero six contact rhein radar one three two decimal four
swissair six seven five two turn left to kamas direct ,081_0100,swi a six seven five two then left two camas direct
alitalia one one seven milan one three four five two good bye ,091_0174,alitalia one one seven milan one three four five two
negative lufthansa four three seven six ,061_0621,negative lufthansa four three seven six
adria one six two seven guten tag identified ,031_0256,area one six two seven good on tag identified
lufthansa eight two six eight contact zurich one three four decimal six ,031_0396,lufthansa eight two six eight contact zurich one three four decimal six
delta foxtrot sierra climb flight level three one zero ,101_0386,del a fox to the climb flight level three rhine zero
lufthansa three five five zero contact zurich one three four decimal six ,021_0614,lufthansa three five five zero contact zurich one three four decimal six
alitalia two nine two as well rhein one two zero nine two ciao ,111_0148,alitalia two nine two as well rhein one two zero nine t u to
hapag lloyd three five five one zurich radar one three three decimal four ,061_0605,hapag loyd three five five one zurich radar one three three desimal four
jetaviation seven zero one milan one three four five two good bye ,092_0406,jetaviation seven zero one milan one three four five two good bye
ukay six two five milano on one two five eight five good bye ,071_0476,ukay six two five milano one one two five eiht five good bye
aviva nine zero eight one descend to flight level three three zero ,091_0376,have u a nine zero eight one descend to flight level three three zero
u s air one four descend to flight level three three zero ,081_0822,u s air one four descend flight level three three zero
lufthansa four four zero eight climb flight level three one zero initially ,101_0293,lufthansa four four zero eight climb flight level three one zero initially
and that wasnt air malta calling say again your callsign ,111_0752,and a was in a malta calling tag on your call sing
alitalia four one three continue climb to level two nine zero ,012_0155,alitalia four one three continue climb to level two nine zero
lufthansa five two nine four good morning radar contact ah recleared flight level three three zero ,091_0262,lufthansa five two nine four good morning radar contact recklair flight level three three zero
adria one six two seven is identified ,041_0629,adria one six two seven is identified
