transcription,recording_id,model_transcription
hapag lloyd one seven one ah geneva one three three one five good bye ,092_0241,appagload one seven one geneva one three three one five quye
united six nine descend flight level two nine zero ,081_0651,united six nine descend flight level two nine zero
swissair six seven five two contact marseille on ah one two five eight five good bye ,071_0509,susa six seven five two contact marseille on one two five eight five good bye
blue five seven two good morning descend to flight level three four zero ,091_0008,blue five seven two good morning descend to flight level three four zero
lufthansa three three three zero climb to flight level two nine zero ,021_0707,lufthansa tra tree tree zero climb to flight level two nine zero
bee med one rhein ,051_0315,bee med one rhein
alitalia six four seven four contact rhein one two seven three seven tschuss ,061_0414,alitalia six four seven four contact rhein one two seven three seven three
united six nine own navigation to fusse ,111_0142,united six nine reow navigation to fusse
europa three six three descend flight level three eight zero ,031_0113,europa three six three descend flight level three eight zero
sabena eight three six identified ,041_0614,sawena eight three six identified
indialook expect higher after kilo romeo hotel ill call you back ,051_0241,indialook expect higher after kilo romerotela call u back
hoi k l m two six four identified ,061_0076,i call im two six five identified
sabena eight zero one right turn trasadingen ,031_0533,sabena eight zero one right turn trasadingen
india mike lima lima guten tag identified ,021_0089,india mike lima lima cudntheag identified
tag malaysian two identified ,061_0026,tarmilation two identified
air malta zero zero four radar contact direct karlsruhe ,091_0282,a malta zero zero four radar contact direct call through air
ah lufthansa four five five zero four proceed own navigation to trasadingen ,051_0290,ah lufthansa four five five zero four proceed own navigation to trasadingen
yeah ,051_0300,yeat
speedbird nine four november is your callsign ,111_0693,speedbird nine four no m s a callsign
ill call you back ,051_0198,i call back
air inter three two zero papa hotel is identified maintain level three two zero trasa hochwald morok ,111_0032,eranta three two zero papa hotel is identified maintain level three two zero trasa hochwald morok
lufthansa three five zero eight speed at own convenience contact zurich one three four six tschuss ,041_0396,lufthansa three five zero eight speed at on convenien contact zurich one three four six two
airfrans three two six one turn left heading two five five climb to level two nine zero ,081_0192,airfrans three two six one turn left heading two five five climb to level two nine zero
lufthansa five five zero four proceed own navigation to trasadingen ,021_0615,lufthansa five five zero four proceed own navigation to trasadingen
lufthansa four two two three good afternoon radar contact trasadingen zurich east fusse ,101_0220,lufthansa four tw two three good afternoon radar contact transweding zurogeesfu set
sabena eight three zero contact rhein one two seven three seven tschu ,021_0200,sabena three zero contact rhein one two seven three seven three
adria one six two seven is identified ,051_0732,adria one six two seven is identified
speedway three four six nine good morning roger ,111_0054,speedway three four six nine good morning roger
gulf air zero zero five contact rhein radar one two seven decimal three seven ,012_0306,galfria zero zero five contact rhein radar one two seven decimal three seven
lufthansa three six three eight zurich radar one three four decimal six ,051_0171,lufthansa three six three eight zurich radar one three four decimal six
lufthansa triple five zero resume own navigation inbound fribourg ,082_0048,lufthansa triple five zero resume own navigation in balfreedbug
lufthansa five two one seven guten tag identified proceed direct to dinkelsbuhl ,021_0284,lufthangra five two one seven tag identified proceed direct to dinkelsbu
alitalia one five seven radar contact ,041_0529,alitalia one five seven radar contact
german air force five eight five contact rhein one three ah one two seven three seven ,051_0510,german air force five eight five contact rhein one three ah one two seven three seven
bye ,111_0217,i
delta echo bravo ,111_0642,delta echo bravo
scandinavian six one seven descend to flight level two nine zero descend at one thousand five hundred feet per minute or more ,011_0285,sceninarian six one seven descend to flight level two nine zero descended one thousand five hundred feet per minute or more
jetcom one three three for further climb zurich one three three four good bye ,092_0233,jetcom one three three four four do climb zurich one three three four bye
bee med one contact rhein radar one three two decimal four ,031_0638,bee med one contact rhein radar one three two decimal four
condor one zero four contact now zurich on one three three decimal four good bye ,092_0242,con do one zero four contact now zurich on one three three decimal four bye
tag alitalia four eight five identified ,061_0092,tag alitalia fueight five identified
tag german air force five eight five identified report your heading ,051_0469,tag tran air for five eight five identified report i heading
midland seven two zero contact rhein one two seven decimal three seven ,021_0133,midland seven two zero contact rhein one two seven decimal three seven
u s air one four direct fusse ,081_0573,u s air one four direct fusse
roger ill call you back ,041_0422,rachak holibag
lufthansa five two one seven is identified good afternoon ,041_0110,lufthansa five two one seven sihdentifie godoftinal
alitalia four zero one contact zurich one three four decimal six ,011_0109,alitalia four zero one contact zurich one three four decimal six
lufthansa five nine three one bonjour maintain flight level three zero zero st prex willisau ,071_0679,than s a five nine three one bronsuaaintal flectdebel three zero zero si prex willisau
lufthansa four five eight two good morning ,111_0375,houfthansa four five eight two good morning
l t u seven seven five six ah geneva one two eight one five good bye ,071_0513,l t u seven seven five six geneva one two eight one five good bye
sabena eight three two contact rhein one two seven three seven ,011_0083,sabena eight three two contact rhein one two seven three seven
transavia three zero six three you have been sent to wrong frequency contact rhein one three two decimal four ,041_0708,transavia three zero six three of been sent to wrong frequency contact rhein one three two decimal four
tag sunwing five two one two identified ,021_0288,tag sunwing five two one two identified
sabena four eight one contact rhein one three two decimal four ,051_0011,sabena four eight one contact rhein one three two decimal four
jetaviation ah seven oh one squawk two seven three two ,081_0873,jet deviationah seven one squawk two seven three two
sabena seven eight one six radar contact proceed trasadingen karlsruhe ,081_0473,sabena seven eight one six radar con sec procee trasad in call three
the lufthansa three six zero four is identified climb to flight level two five zero initially ,041_0007,lufthansa three six zero four identified climb to flight level two five zero initially
swissair six five two zero good afternoon radar contact climb flight level three two zero ,111_0390,swissair six five two zero good afternoon radar contact climb flight level three two zero
sabena four one eight four eight one descend flight level two nine zero ,031_0384,sabena four one eight four eight one descend flight level two nine zero
aerovic one zero six one call now genev sorry m milan one three four decimal five two bye bye ,101_1033,air back one zero six one colnaugine sure and one three four decimal five two bye bye
aero lloyd five nine zero contact zurich one three four decimal six ,011_0088,aeroloid five nine zero contact zurich one three four decimal six
k l m two six four for shortcut turn left by ten degrees ,031_0050,calim two six four four short cot turn left by ten degrees
correct ,091_1010,correct
transwede one zero seven contact geneva one three three one five bye bye ,082_0095,transwede one zru seven contact geneva one three three one five bye bye
aerovic one zero six one maintain your speed decimal seven five or less ,041_0670,aerewack one zero six one maintain easpeed decimal seven five four less
alitalia four eight five descend to flight level two nine zero ,091_0207,alitalia four eight five descend to flight level two nine zero
hamburg air two five four six marseille one two five eight five good bye ,081_0133,ambergia two five four six marse one two five it five good bye
alitalia two nine one turn now right to trasadingen ,041_0124,alitalia two nine one turn now right to transading
roger turn left heading two two zero ,071_0462,roger on lefteaning two two zero
alitalia one one seven good morning descend to level three three zero ,101_0632,alitalia one one seven good morning descend to level three three zero
georgia zero three seven contact rhein one two seven decimal three seven ,051_0053,georgia zero three seven contact rhein one two seven decimal three seven
lufthansa three five zero eight climb flight level three zero zero expedite climb ,041_0378,lufthansa three five zero eight climb flight level three zero zero expodigt climb
air link one three call milan one three four decimal five two bye bye ,111_0319,earling one three call milan one three four decimal five two bye bye
roger turn left heading three three zero to permit further climb ,072_0035,argeaton left heading three three zero to permit further climb
tag belstar five zero two hotel identified ,051_0528,to belstar five zero two hotel identified
aero lloyd five six two proceed from present position to hochwald hotel oscar charlie afterwards to st prex that is sierra papa romeo and then flight planned route ,021_0705,erolloyd five six two proceed from present position to hochwald hotel oscar charlie afterwards to sent prex paris sierra papa romeo and then flight planrude
alitalia two nine two radar contact climb flight level two nine zero ,091_0413,alitalia two nine two radar contact clim flight level two nine zero
hapag lloyd six five three good afternoon climb to flight level three three zero ,081_0762,apag lloyd six five three good afternoon climb to fight level three three zero
aero lloyd five nine zero rhein radar identified climb flight level two nine zero ,051_0061,eroloyd five nine zero rhein radar identified climb flight level two nine zero
aero lloyd five one seven contact rhein one two zero nine two tschuss ,091_0645,aero lloyd five one seven contact rhein one two zero nine two s
india foxtrot golf is identified ill call you back for higher in two minutes ,092_0316,india foxtrot golf is identified ah colliback for heihreing two minutes
tag lufthansa three five zero eight identified maintain two four zero upon reaching ill call you back for higher ,031_0327,tag lufthansa three five zero eight identified maintain two four zero ponereaching a call i back for higher
leisure six zero two four ah in radar contact ,041_0425,legia six zero two four in radar contact
lufthansa eight two two one good morning radar contact ,111_0127,lufthansa ege two two one good morning radar contact
sabena eight zero six climb flight level three four zero ,101_0212,sabena eight r u six climb flight level three four zero
britannia three zero six alfa contact rhein one three two decimal four tschuss ,061_0493,britannia three zero six i fo for decim one three two decimal fortress
lufthansa eight two six eight expect further climb in about one and a half minute ,051_0430,lufthansa eight two six eight expect five climb in about one a half minute
onur nine eight nine radar contact ,061_0232,au no nine eight nine radar contact
swissair nine three five two climb to flight level three five zero ,041_0413,swissair nine three five two climb to flight level three five zero
alitalia three six nine turn right to trasa ,031_0700,alitalia three six nine turn right to trasa
swissair nine three five nine descend now flight level three three zero descend at two thousand feet per minute or more ,011_0310,sata nine three five nine descend now flight level three three zero descend two thousand feeftteen minute or more
lufthansa five two three six is identified proceed direct to november tango mike ,051_0676,lufthansa five two three six identified proceddie two november tango mike
lufthansa four four zero eight direct st prex ,101_0312,lufthansa four four zero eight direct and prex
lufthansa four three nine zero proceed direct to canne ,111_0609,lufthansa four three nine zero proceed direct to canne
l t u seven seven five six ah good afternoon roger ,081_0823,l t u seven seven five six ah good afternoon roger
mission six zero one five three own navigation to tango ,101_0714,mission six zero one five three own navigation to tango
swissair nine three six zero climb to flight level three one zero initially ,021_0530,swissair nine three six zero climb to flight level three one zero initially
and speedbird one two nine who cleared you down to flight level one four zero ,071_0015,in speedbird one two nine who cleared u down to flight level one four zero
tag alitalia one three five identified ,041_0324,tag alitalia one three five identified
belgian airforce four four contact rhein radar one two seven decimal three seven ,012_0271,belgian airforce four four contact rhein radar one two seven decimal three seven
tag hapag lloyd one one two identified direct frankfurt ,031_0175,tahabaglaud one one two identified direct frankfurt
transwede one zero seven geneva one three three one five good bye ,081_0324,transwede one zero seven geneva one three three one five bye
alitalia four zero one milan one three four five two good bye ,092_0390,alitalia four iearo one milan one three four five two good bye
alitalia four zero four ,101_0452,alitalia four zero four
alitalia four zero one continue present heading ,081_0360,alitalia four zero one continue present heading
speedway two three five two contact zurich on one three four decimal six good bye ,071_0615,it rate three three five two contact zuri on one three four decimal six good bye
tag berlin five two five five identified direct fox fox mike ,041_0197,tag berlin five two five five identified direct fox fox mike
iberia three five three zero good morning radar contact proceed inbound zurich east fusse ,101_0256,iberia three f three zero co morning radar contact proceed in powndzurigees fu set
delta india mike mike echo zurich one three four six tschuss ,041_0331,heltania mike mike echo zurich one three four six three
bye bye ,101_0426,good bye
lufthansa four seven zero zero fly heading two one zero for shortcut ,111_0264,lufthansa four seven zero zero fly heading two one zero four so cot
delta echo bravo contact zurich one three four six tschuss ,041_0199,state echo bravo contact zurich one three four six three
lufthansa four four one six good afternoon radar contact if i give you climb clearance could you make it with ah two thousand ,111_0561,lufthansa four four one six good afternoon radar contact if i give you climb cleons could you make it with ah two thousand
lufthansa three five six six contact zurich one three four decimal six ,012_0200,lufthansa three five six six contact zurich one three four decimal six
air malta four five zero squawk seven five three four ,111_0753,ai malta four five zero squawk seven five three four
airfrans three five six climb flight level three two zero ,091_0396,airfrans three five six cli flight level three two zero
air berlin five two five five proceed to trasadingen ,111_0613,earlen five two five five proceed to trasadingen
merair six nine four four contact zurich on one three four six good day ,071_0131,may air six nine four four contact zurich on one three four six good day
bull blue five seven two contact milan one three four five two bye ,091_0311,bull blue five seven two kinds of milan one three four five two bye
oh im sorry ah mis ah merair six nine four four maintain three one zero i see your destination sorry maintain three one zero ,101_0503,oh im sorry ah mis med six nine four four maintain three one zero i see your destination sorry maintain three one zero
sabena eight two six alfa good morning squawk seven five three one ,091_0393,sabena eight two six alfa good morning squawk seven five three one
ah confirm that tarom three seven four called ,031_0641,ah confirm the town three seven four could
united six nine good morning radar contact descend to flight level three zero zero ,082_0085,united six nine good morning radar contact descend to flight level three zero zero
roger and how do you read now ,061_0586,roger and how do you read now
lufthansa three five six six contact zurich one three four decimal six ,051_0228,lufthansa three five six six contact zurich one three four decimal six
swissair six five nine descend to flight level two two zero ,071_0756,the ta six five nine descend to flight level two two zero
delta mike echo proceed to trasadingen ,021_0645,delta mike echo proceed to trasadingen
tag lufthansa three five six six identified climb flight level two nine zero ,041_0208,tag lufthansa three five six six identified climb flight level two nine zero
georgia air zero three seven rhein radar identified ,031_0409,chargia air zero three seven rhein radar identified
lufthansa five two three six call rhein one two seven three seven good day ,071_0034,lufthansa five two three six call rhein one two seven three seven good day
alitalia four zero four rhein one three two decimal four bye bye ,101_0997,alitalia four zero four rhein one three two decimal four bye bye
alitalia two nine two good morning radar contact ,061_0319,alitalia two nine two good morning radar contact
tag alitalia four eight seven identified ,061_0123,tag alitalia fouight seven identified
delta india charlie papa alfa rhein radar identified ,051_0080,dealindochali papa alfa rhein radar identified
hapag lloyd one nine five cleared direct larvi ,071_0792,hapotloyd one nine five clear did larvi
tarom three seven four contact rhein radar one three two decimal four ,031_0664,town three seven four contact rhein radar one three two decimal four
europa three eight one turn left heading zero zero five ,081_0058,aero robarthreat one and left heading zero zero five
algerie two zero seven three direct to trasadingen now ,041_0359,algerie two zero seven three direct to trasading now
condor four nine nine contact reims one three four decimal four good bye ,071_0747,condor four nine nine contact reims one three four decimal four good bye
sabena eight three eight radar contact ,012_0013,sabena eight three eight radar contact
u s air one four milan one three four five two good bye ,111_0114,u s air one four milan one three four five two good bye
u s air one four descend to flight level three one zero ,091_0653,u s air one four descend flight level three one zero
transwede one zero seven contact geneva one three three one five bye ,111_0537,transwede one zero seven contact geneva one three three one five five
alitalia six four seven four contact ahm rhein control on one two zero nine two bye bye ,101_0030,alitalia six four seven four contact rhein control on one two zero nine two bye bye
k l m three four six rhein radar one two seven decimal three seven ,021_0588,kilam three four six rhein radar one two seven decimal three seven
scandinavian six eight six report your heading ,091_0001,scandinavian six eight six three pordoheading
iberia two six six three contact zurich on one two five decimal eight five good bye ,071_0645,agraya two six six three contact zuric on one two five descend minute five good bye
iberia three four two two own navigation to nelli ,092_0340,iberia three four two two own navigation to nelli
cotam one one four one climb to flight level three three zero ,091_0609,cotam one one four one climb to flight level three three zero
alitalia three two four good afternoon squawk five seven four seven ,101_0959,alitalia three two four good afternoon squawk five seven four seven
condor nine seven two contact zurich one three three decimal four ,111_0645,connar nine seven two contact zurich one three three decimal four
lufthansa four six five two turn right to st prex climb to flight level three three zero ,081_0357,lufthansa four six five two turn right to so bre climb to flight level three three zero
swissair six five five two milan one three four five two good bye ,092_0269,swesa six five five two milan one three four five two bye
german air force four one four call now geneva one three three one five bye bye ,091_1001,german air force four one four corna geneva one three three one five bye bye
lufthansa three five zero eight zurich one three four six ,071_0166,lufthansa three five zer eight zurich one three four six
belgian airforce one four four contact rhein radar ah disregard belgian airforce one four four turn right ten degrees report new heading ,041_0663,belgian airforce one four four contact rhein radar ah disregard belgian airforce one four four ten right ten degrees report new heading
cross air five one two ah zurich one two five eight five ,081_0092,rosaira five one two zuric one two five eat five
malaysian ah four is identified ,011_0297,malaysiane fo is identified
lufthansa three six zero four is identified climb to flight level two nine zero ,012_0178,lufthansa three six zero four identified climb to flight level to nine zero
alitalia four zero one buongiorno maintain three three zero trasadingen saronno ,081_0856,alitalia four zero one one on no maintain three three zero trasadingen zero
jetaviation seven zero one own navigation to st prex ,091_0239,jetaviation seven zero one own navigation to st prex
airfrans three two six climb now to flight level two nine zero turn further left heading two four five ,091_0557,airfrans three two six climb out flight level two nine zero turn further left heading two four five
aerovic one zero six one zurich one three four decimal six ,051_0350,are back one zero six one zurich one three four decimal six
hamburg air two five four six contact geneva one three three one five bye bye ,081_0966,hamburg air two five four six contact geneva one three three one five bye bye
air berlin five two six one contact geneva on one three three one five bye bye ,101_0408,aeboline five two six one contact ueneva on one three three one five bye bye
aero lloyd five six zero turn right direct to st prex ,081_0202,aero lloyd five six zero turn right direct to st prex
jet set one four two nine rhein radar identified ,051_0057,jet set one four two nine rhein radar identified
bee med one contact rhein on one three two decimal four good day ,071_0073,bee med one contact rhein on one three two decimal four good day
midland seven two zero rhein radar identified ,061_0609,midland seven two zero rhein radar identified
and swissair eight zero six youre cleared from present position to costa which is charlie oscar alfa ,011_0209,an swiss eight zero six earclead from present position to costa which is charl oscar alfa
lufthansa four seven zero zero is identified proceed to trasadingen climb to flight level two nine zero ,051_0221,lufthansa four seven zero zero is identified proceed to trasadingen climb to flight level two nine zero
k l m two six four is identified ,051_0058,calim two six four identified
air berlin five two five five contact rhein radar one two seven decimal three seven ,031_0563,aero line five two five five contact rhein radar one two seven decimal three seven
sabena eight three zero contact rhein one two seven three seven good day ,071_0029,sabena eight three zero contact rhein one two seven three seven good day
and swissair eight zero six contact rhein radar one two seven decimal three seven ,051_0202,an swi a eight zero six contact rhein radar one two seven decimal three seven
lufthansa three six zero four zurich radar good morning maintain flight level three zero zero route trasadingen saronno ,091_1054,lufthansa three six zero four zericwaighd air good morning maintain flight level three zero zero rud trasadingen zero no
united six nine descend to flight level two nine zero ,081_0352,united six nine descend flight level two nine zero
german air force four one four contact zurich one three three decimal four ,051_0175,german air force four one four contact zero one three three decimal four
air malta four five zero identified route ageri zurich east nelli maintain flight level three two zero ,101_0929,i malta four five zero identified through tag are soriqeestnelly maintain flight level three two zero
lufthansa four three nine three ,081_0266,lufthansa four three night three
sunwing five two one four contact zurich one three three decimal four ,011_0358,sanging five two one four contact zurich one three three decimal four
transwede three five seven one set course direct to hochwald ,091_0027,tran we three five seven one at course direct to hogwald
swissair six five five two contact milan on one three four five two bye ,081_0570,swissair six five five two contact milanna one three four five two bye
french line nine one six five milan one three four decimal five two bye bye ,111_0222,french line nine one six five milan one three four decimal five two bye bye
p s a four zero two hotel guten tag identified ,021_0086,belstar four zero two hotel quudntarg identified
midland seven two zero climb flight level three five zero ,031_0496,midland seven two zero climb flight level three five zero
alitalia four zero one zurich one three four six tschuss ,051_0540,alitalia four zero one zurich one three four six strees
